--SET log_min_messages  TO DEBUG1;
--SET client_min_messages  TO DEBUG1;
--Testcase 44:
CREATE EXTENSION sqlite_fdw;
--Testcase 45:
CREATE SERVER sqlite_svr FOREIGN DATA WRAPPER sqlite_fdw
OPTIONS (database '/tmp/sqlitefdw_test.db');
--Testcase 46:
CREATE SERVER sqlite2 FOREIGN DATA WRAPPER sqlite_fdw;
IMPORT FOREIGN SCHEMA public FROM SERVER sqlite_svr INTO public;
--Testcase 1:
INSERT INTO "type_STRING"(col) VALUES ('string');
--Testcase 2:
INSERT INTO "type_BOOLEAN"(col) VALUES (TRUE);
--Testcase 3:
INSERT INTO "type_BOOLEAN"(col) VALUES (FALSE);
--Testcase 4:
INSERT INTO "type_BYTE"(col) VALUES ('c');
--Testcase 5:
INSERT INTO "type_SINT"(col) VALUES (32767);
--Testcase 6:
INSERT INTO "type_SINT"(col) VALUES (-32768);
--Testcase 7:
INSERT INTO "type_BINT"(col) VALUES (9223372036854775807);
--Testcase 8:
INSERT INTO "type_BINT"(col) VALUES (-9223372036854775808);
--Testcase 9:
INSERT INTO "type_INTEGER"(col) VALUES (9223372036854775807);
--Testcase 10:
INSERT INTO "type_FLOAT"(col) VALUES (3.1415);
--Testcase 11:
INSERT INTO "type_DOUBLE"(col) VALUES (3.14159265);
--Testcase 12:
INSERT INTO "type_TIMESTAMP" VALUES ('2017.11.06 12:34:56.789', '2017.11.06');
--Testcase 13:
INSERT INTO "type_TIMESTAMP" VALUES ('2017.11.06 1:3:0', '2017.11.07');
--Testcase 14:
INSERT INTO "type_BLOB"(col) VALUES (bytea('\xDEADBEEF'));
--Testcase 15:
INSERT INTO typetest VALUES(1,'a', 'b', 'c','2017.11.06 12:34:56.789', '2017.11.06 12:34:56.789' ) ;
--Testcase 16:
SELECT * FROM "type_STRING";
  col   
--------
 string
(1 row)

--Testcase 17:
SELECT * FROM "type_BOOLEAN";
 col 
-----
 t
 f
(2 rows)

--Testcase 18:
SELECT * FROM "type_BYTE";
 col 
-----
 c
(1 row)

--Testcase 19:
SELECT * FROM "type_SINT";
  col   
--------
  32767
 -32768
(2 rows)

--Testcase 20:
SELECT * FROM "type_BINT";
         col          
----------------------
  9223372036854775807
 -9223372036854775808
(2 rows)

--Testcase 21:
SELECT * FROM "type_INTEGER";
         col         
---------------------
 9223372036854775807
(1 row)

--Testcase 22:
SELECT * FROM "type_FLOAT";
  col   
--------
 3.1415
(1 row)

--Testcase 23:
SELECT * FROM "type_DOUBLE";
    col     
------------
 3.14159265
(1 row)

set datestyle=ISO;
--Testcase 24:
SELECT * FROM "type_TIMESTAMP";
           col           |          b          
-------------------------+---------------------
 2017-11-06 12:34:56.789 | 2017-11-06 00:00:00
 2017-11-06 01:03:00     | 2017-11-07 00:00:00
(2 rows)

--Testcase 25:
SELECT * FROM "type_BLOB";
    col     
------------
 \xdeadbeef
(1 row)

--Testcase 26:
SELECT * FROM typetest;
 i | v |     c      | t |            d            |           ti            
---+---+------------+---+-------------------------+-------------------------
 1 | a | b          | c | 2017-11-06 12:34:56.789 | 2017-11-06 12:34:56.789
(1 row)

--Testcase 27:
insert into "type_STRING" values('TYPE');
--Testcase 28:
insert into "type_STRING" values('type');
-- not pushdown
--Testcase 29:
SELECT  *FROM "type_STRING" WHERE col like 'TYP%';
 col  
------
 TYPE
(1 row)

--Testcase 30:
EXPLAIN SELECT  *FROM "type_STRING" WHERE col like 'TYP%';
                            QUERY PLAN                             
-------------------------------------------------------------------
 Foreign Scan on "type_STRING"  (cost=10.00..7.00 rows=7 width=32)
(1 row)

-- pushdown
--Testcase 31:
SELECT  *FROM "type_STRING" WHERE col ilike 'typ%';
 col  
------
 TYPE
 type
(2 rows)

--Testcase 32:
EXPLAIN SELECT  *FROM "type_STRING" WHERE col ilike 'typ%';
                             QUERY PLAN                              
---------------------------------------------------------------------
 Foreign Scan on "type_STRING"  (cost=10.00..58.00 rows=58 width=32)
   Filter: (col ~~* 'typ%'::text)
(2 rows)

--Testcase 33:
SELECT  *FROM "type_STRING" WHERE col ilike 'typ%' and col like 'TYPE';
 col  
------
 TYPE
(1 row)

--Testcase 34:
EXPLAIN SELECT  *FROM "type_STRING" WHERE col ilike 'typ%' and col like 'TYPE';
                            QUERY PLAN                             
-------------------------------------------------------------------
 Foreign Scan on "type_STRING"  (cost=10.00..1.00 rows=1 width=32)
   Filter: (col ~~* 'typ%'::text)
(2 rows)

--Testcase 35:
SELECT * FROM "type_TIMESTAMP";
           col           |          b          
-------------------------+---------------------
 2017-11-06 12:34:56.789 | 2017-11-06 00:00:00
 2017-11-06 01:03:00     | 2017-11-07 00:00:00
(2 rows)

--Testcase 36:
EXPLAIN (VERBOSE, COSTS OFF) SELECT * FROM  "type_TIMESTAMP" WHERE col > date ('2017.11.06 12:34:56.789') ;
                                         QUERY PLAN                                          
---------------------------------------------------------------------------------------------
 Foreign Scan on public."type_TIMESTAMP"
   Output: col, b
   SQLite query: SELECT `col`, `b` FROM main."type_TIMESTAMP" WHERE ((`col` > '2017-11-06'))
(3 rows)

--Testcase 37:
SELECT * FROM  "type_TIMESTAMP" WHERE col > date ('2017.11.06 12:34:56.789') ;
           col           |          b          
-------------------------+---------------------
 2017-11-06 01:03:00     | 2017-11-07 00:00:00
 2017-11-06 12:34:56.789 | 2017-11-06 00:00:00
(2 rows)

--Testcase 38:
EXPLAIN (VERBOSE, COSTS OFF) SELECT * FROM  "type_TIMESTAMP" WHERE col::text > date ('2017.11.06 12:34:56.789')::text ;
                              QUERY PLAN                               
-----------------------------------------------------------------------
 Foreign Scan on public."type_TIMESTAMP"
   Output: col, b
   Filter: (("type_TIMESTAMP".col)::text > ('2017-11-06'::date)::text)
   SQLite query: SELECT `col`, `b` FROM main."type_TIMESTAMP"
(4 rows)

--Testcase 39:
SELECT * FROM  "type_TIMESTAMP" WHERE col::text > date ('2017.11.06 12:34:56.789')::text ;
           col           |          b          
-------------------------+---------------------
 2017-11-06 12:34:56.789 | 2017-11-06 00:00:00
 2017-11-06 01:03:00     | 2017-11-07 00:00:00
(2 rows)

--Testcase 40:
EXPLAIN  (VERBOSE, COSTS OFF) SELECT * FROM  "type_TIMESTAMP" WHERE col > b - interval '1 hour'; 
                                   QUERY PLAN                                   
--------------------------------------------------------------------------------
 Foreign Scan on public."type_TIMESTAMP"
   Output: col, b
   Filter: ("type_TIMESTAMP".col > ("type_TIMESTAMP".b - '@ 1 hour'::interval))
   SQLite query: SELECT `col`, `b` FROM main."type_TIMESTAMP"
(4 rows)

--Testcase 41:
SELECT * FROM  "type_TIMESTAMP" WHERE col > b - interval '1 hour';
           col           |          b          
-------------------------+---------------------
 2017-11-06 12:34:56.789 | 2017-11-06 00:00:00
(1 row)

--Testcase 42:
EXPLAIN (VERBOSE, COSTS OFF) SELECT * FROM  "type_TIMESTAMP" WHERE col > b;
                                     QUERY PLAN                                     
------------------------------------------------------------------------------------
 Foreign Scan on public."type_TIMESTAMP"
   Output: col, b
   SQLite query: SELECT `col`, `b` FROM main."type_TIMESTAMP" WHERE ((`col` > `b`))
(3 rows)

--Testcase 43:
SELECT * FROM  "type_TIMESTAMP" WHERE col > b;
           col           |          b          
-------------------------+---------------------
 2017-11-06 12:34:56.789 | 2017-11-06 00:00:00
(1 row)

--Testcase 48:
INSERT INTO "type_DATE"(col) VALUES ('2021.02.23');
--Testcase 49:
INSERT INTO "type_DATE"(col) VALUES ('2021/03/08');
--Testcase 50:
INSERT INTO "type_DATE"(col) VALUES ('9999-12-30');
--Testcase 58:
SELECT * FROM "type_DATE";
    col     
------------
 2021-02-23
 2021-03-08
 9999-12-30
(3 rows)

--Testcase 51:
INSERT INTO "type_TIME"(col) VALUES ('01:23:45');
--Testcase 52:
INSERT INTO "type_TIME"(col) VALUES ('01:23:45.6789');
--Testcase 59:
SELECT * FROM "type_TIME";
      col      
---------------
 01:23:45
 01:23:45.6789
(2 rows)

--Testcase 60:
EXPLAIN VERBOSE
SELECT c1, c2, c3, c4, c5, c6, c7, c8, c9, c10, c11, c12, c13, c14, c15, c17, c18, c19, c2, c21, c22, c23, c24 FROM alltypetest;
                                                                                           QUERY PLAN                                                                                           
------------------------------------------------------------------------------------------------------------------------------------------------------------------------------------------------
 Foreign Scan on public.alltypetest  (cost=10.00..57.00 rows=57 width=1400)
   Output: c1, c2, c3, c4, c5, c6, c7, c8, c9, c10, c11, c12, c13, c14, c15, c17, c18, c19, c2, c21, c22, c23, c24
   SQLite query: SELECT `c1`, `c2`, `c3`, `c4`, `c5`, `c6`, `c7`, `c8`, `c9`, `c10`, `c11`, `c12`, `c13`, `c14`, `c15`, `c17`, `c18`, `c19`, `c21`, `c22`, `c23`, `c24` FROM main."alltypetest"
(3 rows)

--Testcase 61:
SELECT c1, c2, c3, c4, c5, c6, c7, c8, c9, c10, c11, c12, c13, c14, c15,  c17, c18, c19, c2, c21, c22, c23, c24 FROM alltypetest;
   c1   | c2  |  c3   |   c4   |      c5       |      c6      |      c7       |     c8     |          c9          |          c10           |         c11         |       c12        |                    c13                    |             c14             |           c15            |   c17   |     c18      |     c19     | c2  | c21  |     c22     |    c23     |         c24         
--------+-----+-------+--------+---------------+--------------+---------------+------------+----------------------+------------------------+---------------------+------------------+-------------------------------------------+-----------------------------+--------------------------+---------+--------------+-------------+-----+------+-------------+------------+---------------------
 583647 | 127 | 12767 | 388607 | 2036854775807 | 573709551615 | 2036854775807 | abcdefghij | abcdefghijjhgfjfuafh | Côte dIvoire Fijifoxju | Hôm nay tôi rất vui | I am happy today | 今日はとても幸せです 今日はとても幸せです | The quick brown fox jumps o | ABCDEFGHIJKLMNOPQRSTUVWX | 3.4e+18 | 1.79769e+108 | 1.79769e+88 | 127 | 1234 | 99999.99999 | 9999-12-31 | 9999-12-31 23:59:59
(1 row)

--Testcase 53:
CREATE FOREIGN TABLE type_JSON(col JSON OPTIONS (key 'true')) SERVER sqlite_svr OPTIONS (table 'type_TEXT');
--Testcase 54:
INSERT INTO type_JSON(col) VALUES ('[1, 2, "foo", null]');
--Testcase 55:
INSERT INTO type_JSON(col) VALUES ('{"bar": "baz", "balance": 7.77, "active": false}'::json);
--Testcase 56
SELECT * FROM type_JSON;
                       col                        
--------------------------------------------------
 [1, 2, "foo", null]
 {"bar": "baz", "balance": 7.77, "active": false}
(2 rows)

--Testcase 57
DELETE FROM type_JSON;
-- drop column
--Testcase 62:
DROP FOREIGN TABLE IF EXISTS "type_BOOLEAN";
--Testcase 63:
CREATE FOREIGN TABLE "type_BOOLEAN" (colx int, col boolean) SERVER sqlite_svr;
--Testcase 64:
ALTER FOREIGN TABLE "type_BOOLEAN" DROP COLUMN colx;
--Testcase 65:
SELECT * FROM "type_BOOLEAN"; -- OK
 col 
-----
 t
 f
(2 rows)

-- define INTEGER as TEXT column
--Testcase 67:
ALTER FOREIGN TABLE "type_INTEGER" ALTER COLUMN col TYPE text;
--Testcase 68:
SELECT * FROM "type_INTEGER"; -- OK
         col         
---------------------
 9223372036854775807
(1 row)

-- define INTEGER as bpchar
--Testcase 69:
ALTER FOREIGN TABLE "type_INTEGER" ALTER COLUMN col TYPE char(30);
--Testcase 70:
SELECT * FROM "type_INTEGER"; -- OK
              col               
--------------------------------
 9223372036854775807           
(1 row)

-- define INTEGER as varchar
--Testcase 71:
ALTER FOREIGN TABLE "type_INTEGER" ALTER COLUMN col TYPE varchar(30);
--Testcase 72:
SELECT * FROM "type_INTEGER"; -- OK
         col         
---------------------
 9223372036854775807
(1 row)

-- define INTEGER as name
--Testcase 73:
ALTER FOREIGN TABLE "type_INTEGER" ALTER COLUMN col TYPE name;
--Testcase 74:
SELECT * FROM "type_INTEGER"; -- OK
         col         
---------------------
 9223372036854775807
(1 row)

-- define INTEGER as json
--Testcase 75:
ALTER FOREIGN TABLE "type_INTEGER" ALTER COLUMN col TYPE json;
--Testcase 76:
SELECT * FROM "type_INTEGER"; -- OK
         col         
---------------------
 9223372036854775807
(1 row)

-- define INTEGER as time
--Testcase 77:
DELETE FROM "type_INTEGER";
--Testcase 78:
ALTER FOREIGN TABLE "type_INTEGER" ALTER COLUMN col TYPE int;
--Testcase 79:
INSERT INTO "type_INTEGER" VALUES (120506);
--Testcase 80:
ALTER FOREIGN TABLE "type_INTEGER" ALTER COLUMN col TYPE time;
--Testcase 81:
SELECT * FROM "type_INTEGER"; -- OK
   col    
----------
 12:05:06
(1 row)

-- define INTEGER as date
--Testcase 82:
ALTER FOREIGN TABLE "type_INTEGER" ALTER COLUMN col TYPE date;
--Testcase 83:
SELECT * FROM "type_INTEGER"; -- OK
    col     
------------
 2012-05-06
(1 row)

--Testcase 84:
ALTER FOREIGN TABLE "type_INTEGER" ALTER COLUMN col TYPE int;
--Testcase 85:
INSERT INTO "type_DOUBLE" VALUES (1.3e-5);
--Testcase 86:
SELECT * FROM "type_DOUBLE";
    col     
------------
 3.14159265
    1.3e-05
(2 rows)

-- define DOUBLE as TEXT column
--Testcase 87:
ALTER FOREIGN TABLE "type_DOUBLE" ALTER COLUMN col TYPE text;
--Testcase 88:
SELECT * FROM "type_DOUBLE"; -- OK
    col     
------------
 3.14159265
 1.3e-05
(2 rows)

-- define DOUBLE as bpchar
--Testcase 89:
ALTER FOREIGN TABLE "type_DOUBLE" ALTER COLUMN col TYPE char(30);
--Testcase 90:
SELECT * FROM "type_DOUBLE"; -- OK
              col               
--------------------------------
 3.14159265                    
 1.3e-05                       
(2 rows)

-- define DOUBLE as varchar
--Testcase 91:
ALTER FOREIGN TABLE "type_DOUBLE" ALTER COLUMN col TYPE varchar(30);
--Testcase 92:
SELECT * FROM "type_DOUBLE"; -- OK
    col     
------------
 3.14159265
 1.3e-05
(2 rows)

-- define DOUBLE as name
--Testcase 93:
ALTER FOREIGN TABLE "type_DOUBLE" ALTER COLUMN col TYPE name;
--Testcase 94:
SELECT * FROM "type_DOUBLE"; -- OK
    col     
------------
 3.14159265
 1.3e-05
(2 rows)

-- define DOUBLE as json
--Testcase 95:
ALTER FOREIGN TABLE "type_DOUBLE" ALTER COLUMN col TYPE json;
--Testcase 96:
SELECT * FROM "type_DOUBLE"; -- OK
    col     
------------
 3.14159265
 1.3e-05
(2 rows)

--Testcase 97:
DELETE FROM "type_DOUBLE";
--Testcase 98:
ALTER FOREIGN TABLE "type_DOUBLE" ALTER COLUMN col TYPE float8;
--Testcase 99:
INSERT INTO "type_DOUBLE" VALUES (120506.12);
-- define DOUBLE as time
--Testcase 100:
ALTER FOREIGN TABLE "type_DOUBLE" ALTER COLUMN col TYPE time;
--Testcase 101:
SELECT * FROM "type_DOUBLE"; -- OK
     col     
-------------
 12:05:06.12
(1 row)

--Testcase 102:
DELETE FROM "type_DOUBLE";
--Testcase 103:
ALTER FOREIGN TABLE "type_DOUBLE" ALTER COLUMN col TYPE float8;
--Testcase 104:
INSERT INTO "type_DOUBLE" VALUES (1999.012);
-- define DOUBLE as date
--Testcase 105:
ALTER FOREIGN TABLE "type_DOUBLE" ALTER COLUMN col TYPE date;
--Testcase 106:
SELECT * FROM "type_DOUBLE"; -- OK
    col     
------------
 1999-01-12
(1 row)

--Testcase 107:
ALTER FOREIGN TABLE "type_DOUBLE" ALTER COLUMN col TYPE float8;
--Testcase 199:
DROP FOREIGN TABLE IF EXISTS "type_BIT";
--Testcase 200:
CREATE FOREIGN TABLE "type_BIT"( "i" int OPTIONS (key 'true'), "b" bit(6)) SERVER sqlite_svr OPTIONS (table 'type_BIT');
--Testcase 201:
DROP FOREIGN TABLE IF EXISTS "type_BIT+";
NOTICE:  foreign table "type_BIT+" does not exist, skipping
--Testcase 202:
CREATE FOREIGN TABLE "type_BIT+"( "i" int OPTIONS (key 'true'), "b" bit(6), "t" text, "l" smallint, "bi" bigint OPTIONS (column_name 'b')) SERVER sqlite_svr OPTIONS (table 'type_BIT+');
--Testcase 203:
INSERT INTO "type_BIT" ("i", "b") VALUES (1, 1);
ERROR:  column "b" is of type bit but expression is of type integer
LINE 1: INSERT INTO "type_BIT" ("i", "b") VALUES (1, 1);
                                                     ^
HINT:  You will need to rewrite or cast the expression.
--Testcase 204:
INSERT INTO "type_BIT" ("i", "b") VALUES (2, 2);
ERROR:  column "b" is of type bit but expression is of type integer
LINE 1: INSERT INTO "type_BIT" ("i", "b") VALUES (2, 2);
                                                     ^
HINT:  You will need to rewrite or cast the expression.
--Testcase 205:
INSERT INTO "type_BIT" ("i", "b") VALUES (3, '1');
ERROR:  bit string length 1 does not match type bit(6)
--Testcase 206:
INSERT INTO "type_BIT" ("i", "b") VALUES (4, '10');
ERROR:  bit string length 2 does not match type bit(6)
--Testcase 207:
INSERT INTO "type_BIT" ("i", "b") VALUES (5, '101');
ERROR:  bit string length 3 does not match type bit(6)
--Testcase 208:
INSERT INTO "type_BIT" ("i", "b") VALUES (6, '110110');
--Testcase 209:
INSERT INTO "type_BIT" ("i", "b") VALUES (7, '111001');
--Testcase 210:
INSERT INTO "type_BIT" ("i", "b") VALUES (8, '110000');
--Testcase 211:
INSERT INTO "type_BIT" ("i", "b") VALUES (9, '100001');
--Testcase 212:
INSERT INTO "type_BIT" ("i", "b") VALUES (10, 53);
ERROR:  column "b" is of type bit but expression is of type integer
LINE 1: INSERT INTO "type_BIT" ("i", "b") VALUES (10, 53);
                                                      ^
HINT:  You will need to rewrite or cast the expression.
--Testcase 213:
SELECT * FROM "type_BIT+";
 i |   b    |    t    | l | bi 
---+--------+---------+---+----
 6 | 110110 | integer | 2 | 54
 7 | 111001 | integer | 2 | 57
 8 | 110000 | integer | 2 | 48
 9 | 100001 | integer | 2 | 33
(4 rows)

--Testcase 214:
SELECT * FROM "type_BIT" WHERE b < '110110';
 i |   b    
---+--------
 8 | 110000
 9 | 100001
(2 rows)

--Testcase 215:
SELECT * FROM "type_BIT" WHERE b > '110110';
 i |   b    
---+--------
 7 | 111001
(1 row)

--Testcase 216:
SELECT * FROM "type_BIT" WHERE b = '110110';
 i |   b    
---+--------
 6 | 110110
(1 row)

--Testcase 217:
DROP FOREIGN TABLE IF EXISTS "type_VARBIT";
--Testcase 218:
CREATE FOREIGN TABLE "type_VARBIT"( "i" int OPTIONS (key 'true'), "b" varbit(70)) SERVER sqlite_svr OPTIONS (table 'type_VARBIT');
--Testcase 219:
DROP FOREIGN TABLE IF EXISTS "type_VARBIT+";
NOTICE:  foreign table "type_VARBIT+" does not exist, skipping
--Testcase 220:
CREATE FOREIGN TABLE "type_VARBIT+"( "i" int OPTIONS (key 'true'), "b" varbit(70), "t" text, "l" smallint) SERVER sqlite_svr OPTIONS (table 'type_VARBIT+');
--Testcase 221:
INSERT INTO "type_VARBIT" ("i", "b") VALUES (1, '1');
--Testcase 222:
INSERT INTO "type_VARBIT" ("i", "b") VALUES (2, '10');
--Testcase 223:
INSERT INTO "type_VARBIT" ("i", "b") VALUES (3, '11');
--Testcase 224:
INSERT INTO "type_VARBIT" ("i", "b") VALUES (4, '100');
--Testcase 225:
INSERT INTO "type_VARBIT" ("i", "b") VALUES (5, '101');
--Testcase 226:
INSERT INTO "type_VARBIT" ("i", "b") VALUES (6, '110110');
--Testcase 227:
INSERT INTO "type_VARBIT" ("i", "b") VALUES (7, '111001');
--Testcase 228:
INSERT INTO "type_VARBIT" ("i", "b") VALUES (8, '110000');
--Testcase 229:
INSERT INTO "type_VARBIT" ("i", "b") VALUES (9, '100001');
--Testcase 230:
INSERT INTO "type_VARBIT" ("i", "b") VALUES (10, '0100100101011001010010101000111110110101101101111011000101010');
--Testcase 231:
INSERT INTO "type_VARBIT" ("i", "b") VALUES (11, '01001001010110010100101010001111101101011011011110110001010101');
--Testcase 232
SELECT * FROM "type_VARBIT+";
 i  |                               b                               |    t    | l  
----+---------------------------------------------------------------+---------+----
  1 | 1                                                             | integer |  1
  2 | 10                                                            | integer |  1
  3 | 11                                                            | integer |  1
  4 | 100                                                           | integer |  1
  5 | 101                                                           | integer |  1
  6 | 110110                                                        | integer |  2
  7 | 111001                                                        | integer |  2
  8 | 110000                                                        | integer |  2
  9 | 100001                                                        | integer |  2
 10 | 100100101011001010010101000111110110101101101111011000101010  | integer | 18
 11 | 1001001010110010100101010001111101101011011011110110001010101 | integer | 19
(11 rows)

--Testcase 233:
SELECT * FROM "type_VARBIT+" WHERE b < '110110';
 i |   b    |    t    | l 
---+--------+---------+---
 1 | 1      | integer | 1
 2 | 10     | integer | 1
 3 | 11     | integer | 1
 4 | 100    | integer | 1
 5 | 101    | integer | 1
 8 | 110000 | integer | 2
 9 | 100001 | integer | 2
(7 rows)

--Testcase 234:
SELECT * FROM "type_VARBIT+" WHERE b > '110110';
 i  |                               b                               |    t    | l  
----+---------------------------------------------------------------+---------+----
  7 | 111001                                                        | integer |  2
 10 | 100100101011001010010101000111110110101101101111011000101010  | integer | 18
 11 | 1001001010110010100101010001111101101011011011110110001010101 | integer | 19
(3 rows)

--Testcase 235:
SELECT * FROM "type_VARBIT+" WHERE b = '110110';
 i |   b    |    t    | l 
---+--------+---------+---
 6 | 110110 | integer | 2
(1 row)

--Testcase 236:
INSERT INTO "type_VARBIT" ("i", "b") VALUES (12, '010010010101100101001010100011111011010110110111101100010101010');
--Testcase 237:
INSERT INTO "type_VARBIT" ("i", "b") VALUES (13, '0100100101011001010010101000111110110101101101111011000101010101');
--Testcase 238: very long bit string, expected ERROR, 65 bits
INSERT INTO "type_VARBIT" ("i", "b") VALUES (14, '01001001010110010100101010001111101101011011011110110001010101010');
ERROR:  SQLite FDW dosens't support very long bit/varbit data
HINT:  bit length 65, maxmum 64
--Testcase 239:
SELECT * FROM "type_VARBIT+" WHERE "i" > 10;
 i  |                                b                                |    t    | l  
----+-----------------------------------------------------------------+---------+----
 11 | 1001001010110010100101010001111101101011011011110110001010101   | integer | 19
 12 | 10010010101100101001010100011111011010110110111101100010101010  | integer | 19
 13 | 100100101011001010010101000111110110101101101111011000101010101 | integer | 19
(3 rows)

--Testcase 240:
SELECT b1."i" "i₁", b1."b" "b₁", b2."i" "i₂", b2."b" "b₂", b1."b" | b2."b" "res" FROM "type_BIT" b1 INNER JOIN "type_BIT" b2 ON true;
 i₁ |   b₁   | i₂ |   b₂   |  res   
----+--------+----+--------+--------
  6 | 110110 |  6 | 110110 | 110110
  6 | 110110 |  7 | 111001 | 111111
  6 | 110110 |  8 | 110000 | 110110
  6 | 110110 |  9 | 100001 | 110111
  7 | 111001 |  6 | 110110 | 111111
  7 | 111001 |  7 | 111001 | 111001
  7 | 111001 |  8 | 110000 | 111001
  7 | 111001 |  9 | 100001 | 111001
  8 | 110000 |  6 | 110110 | 110110
  8 | 110000 |  7 | 111001 | 111001
  8 | 110000 |  8 | 110000 | 110000
  8 | 110000 |  9 | 100001 | 110001
  9 | 100001 |  6 | 110110 | 110111
  9 | 100001 |  7 | 111001 | 111001
  9 | 100001 |  8 | 110000 | 110001
  9 | 100001 |  9 | 100001 | 100001
(16 rows)

--Testcase 241:
SELECT b1."i" "i₁", b1."b" "b₁", b2."i" "i₂", b2."b" "b₂", b1."b" & b2."b" "res" FROM "type_BIT" b1 INNER JOIN "type_BIT" b2 ON true;
 i₁ |   b₁   | i₂ |   b₂   |  res   
----+--------+----+--------+--------
  6 | 110110 |  6 | 110110 | 110110
  6 | 110110 |  7 | 111001 | 110000
  6 | 110110 |  8 | 110000 | 110000
  6 | 110110 |  9 | 100001 | 100000
  7 | 111001 |  6 | 110110 | 110000
  7 | 111001 |  7 | 111001 | 111001
  7 | 111001 |  8 | 110000 | 110000
  7 | 111001 |  9 | 100001 | 100001
  8 | 110000 |  6 | 110110 | 110000
  8 | 110000 |  7 | 111001 | 110000
  8 | 110000 |  8 | 110000 | 110000
  8 | 110000 |  9 | 100001 | 100000
  9 | 100001 |  6 | 110110 | 100000
  9 | 100001 |  7 | 111001 | 100001
  9 | 100001 |  8 | 110000 | 100000
  9 | 100001 |  9 | 100001 | 100001
(16 rows)

--Testcase 242:
SELECT b1."i" "i₁", b1."b" "b₁", b2."i" "i₂", b2."b" "b₂", b1."b" # b2."b" "res" FROM "type_BIT" b1 INNER JOIN "type_BIT" b2 ON true;
 i₁ |   b₁   | i₂ |   b₂   |  res   
----+--------+----+--------+--------
  6 | 110110 |  6 | 110110 | 000000
  6 | 110110 |  7 | 111001 | 001111
  6 | 110110 |  8 | 110000 | 000110
  6 | 110110 |  9 | 100001 | 010111
  7 | 111001 |  6 | 110110 | 001111
  7 | 111001 |  7 | 111001 | 000000
  7 | 111001 |  8 | 110000 | 001001
  7 | 111001 |  9 | 100001 | 011000
  8 | 110000 |  6 | 110110 | 000110
  8 | 110000 |  7 | 111001 | 001001
  8 | 110000 |  8 | 110000 | 000000
  8 | 110000 |  9 | 100001 | 010001
  9 | 100001 |  6 | 110110 | 010111
  9 | 100001 |  7 | 111001 | 011000
  9 | 100001 |  8 | 110000 | 010001
  9 | 100001 |  9 | 100001 | 000000
(16 rows)

--Testcase 243:
SELECT "i", "b", "b" >> 2 "res" FROM "type_BIT";
 i |   b    |  res   
---+--------+--------
 6 | 110110 | 001101
 7 | 111001 | 001110
 8 | 110000 | 001100
 9 | 100001 | 001000
(4 rows)

--Testcase 244:
SELECT "i", "b", "b" << 3 "res" FROM "type_BIT";
 i |   b    |  res   
---+--------+--------
 6 | 110110 | 110000
 7 | 111001 | 001000
 8 | 110000 | 000000
 9 | 100001 | 001000
(4 rows)

--Testcase 245:
SELECT "i", "b", ~ "b" "res" FROM "type_BIT";
 i |   b    |  res   
---+--------+--------
 6 | 110110 | 001001
 7 | 111001 | 000110
 8 | 110000 | 001111
 9 | 100001 | 011110
(4 rows)

--Testcase 246:
EXPLAIN VERBOSE
SELECT b1."i" "i₁", b1."b" "b₁", b2."i" "i₂", b2."b" "b₂", b1."b" | b2."b" "res" FROM "type_BIT" b1 INNER JOIN "type_BIT" b2 ON true;
                                         QUERY PLAN                                         
--------------------------------------------------------------------------------------------
 Nested Loop  (cost=20.00..77960.48 rows=4901796 width=58)
   Output: b1.i, b1.b, b2.i, b2.b, (b1.b | b2.b)
   ->  Foreign Scan on public."type_BIT" b1  (cost=10.00..2214.00 rows=2214 width=13)
         Output: b1.i, b1.b
         SQLite query: SELECT `i`, `b` FROM main."type_BIT"
   ->  Materialize  (cost=10.00..2225.07 rows=2214 width=13)
         Output: b2.i, b2.b
         ->  Foreign Scan on public."type_BIT" b2  (cost=10.00..2214.00 rows=2214 width=13)
               Output: b2.i, b2.b
               SQLite query: SELECT `i`, `b` FROM main."type_BIT"
(10 rows)

--Testcase 247:
EXPLAIN VERBOSE
SELECT b1."i" "i₁", b1."b" "b₁", b2."i" "i₂", b2."b" "b₂", b1."b" & b2."b" "res" FROM "type_BIT" b1 INNER JOIN "type_BIT" b2 ON true;
                                         QUERY PLAN                                         
--------------------------------------------------------------------------------------------
 Nested Loop  (cost=20.00..77960.48 rows=4901796 width=58)
   Output: b1.i, b1.b, b2.i, b2.b, (b1.b & b2.b)
   ->  Foreign Scan on public."type_BIT" b1  (cost=10.00..2214.00 rows=2214 width=13)
         Output: b1.i, b1.b
         SQLite query: SELECT `i`, `b` FROM main."type_BIT"
   ->  Materialize  (cost=10.00..2225.07 rows=2214 width=13)
         Output: b2.i, b2.b
         ->  Foreign Scan on public."type_BIT" b2  (cost=10.00..2214.00 rows=2214 width=13)
               Output: b2.i, b2.b
               SQLite query: SELECT `i`, `b` FROM main."type_BIT"
(10 rows)

--Testcase 248:
EXPLAIN VERBOSE
SELECT b1."i" "i₁", b1."b" "b₁", b2."i" "i₂", b2."b" "b₂", b1."b" # b2."b" "res" FROM "type_BIT" b1 INNER JOIN "type_BIT" b2 ON true;
                                         QUERY PLAN                                         
--------------------------------------------------------------------------------------------
 Nested Loop  (cost=20.00..77960.48 rows=4901796 width=58)
   Output: b1.i, b1.b, b2.i, b2.b, (b1.b # b2.b)
   ->  Foreign Scan on public."type_BIT" b1  (cost=10.00..2214.00 rows=2214 width=13)
         Output: b1.i, b1.b
         SQLite query: SELECT `i`, `b` FROM main."type_BIT"
   ->  Materialize  (cost=10.00..2225.07 rows=2214 width=13)
         Output: b2.i, b2.b
         ->  Foreign Scan on public."type_BIT" b2  (cost=10.00..2214.00 rows=2214 width=13)
               Output: b2.i, b2.b
               SQLite query: SELECT `i`, `b` FROM main."type_BIT"
(10 rows)

--Testcase 249:
EXPLAIN VERBOSE
SELECT "i", "b", "b" >> 2 "res" FROM "type_BIT";
                                 QUERY PLAN                                  
-----------------------------------------------------------------------------
 Foreign Scan on public."type_BIT"  (cost=10.00..2219.53 rows=2214 width=45)
   Output: i, b, (b >> 2)
   SQLite query: SELECT `i`, `b` FROM main."type_BIT"
(3 rows)

--Testcase 250:
EXPLAIN VERBOSE
SELECT "i", "b", "b" << 3 "res" FROM "type_BIT";
                                 QUERY PLAN                                  
-----------------------------------------------------------------------------
 Foreign Scan on public."type_BIT"  (cost=10.00..2219.53 rows=2214 width=45)
   Output: i, b, (b << 3)
   SQLite query: SELECT `i`, `b` FROM main."type_BIT"
(3 rows)

--Testcase 251:
EXPLAIN VERBOSE
SELECT "i", "b", ~ "b" "res" FROM "type_BIT";
                                 QUERY PLAN                                  
-----------------------------------------------------------------------------
 Foreign Scan on public."type_BIT"  (cost=10.00..2219.53 rows=2214 width=45)
   Output: i, b, (~ b)
   SQLite query: SELECT `i`, `b` FROM main."type_BIT"
(3 rows)

--Testcase 252:
SELECT b1."i" "i₁", b1."b" "b₁", b2."i" "i₂", b2."b" "b₂", b1."b" | b2."b" "res" FROM "type_VARBIT" b1 INNER JOIN "type_VARBIT" b2 ON true;
ERROR:  cannot OR bit strings of different sizes
--Testcase 253:
SELECT b1."i" "i₁", b1."b" "b₁", b2."i" "i₂", b2."b" "b₂", b1."b" & b2."b" "res" FROM "type_VARBIT" b1 INNER JOIN "type_VARBIT" b2 ON true;
ERROR:  cannot AND bit strings of different sizes
--Testcase 254:
SELECT b1."i" "i₁", b1."b" "b₁", b2."i" "i₂", b2."b" "b₂", b1."b" # b2."b" "res" FROM "type_VARBIT" b1 INNER JOIN "type_VARBIT" b2 ON true;
ERROR:  cannot XOR bit strings of different sizes
--Testcase 255:
SELECT "i", "b", "b" >> 2 "res" FROM "type_VARBIT";
 i  |                                b                                |                               res                               
----+-----------------------------------------------------------------+-----------------------------------------------------------------
  1 | 1                                                               | 0
  2 | 10                                                              | 00
  3 | 11                                                              | 00
  4 | 100                                                             | 001
  5 | 101                                                             | 001
  6 | 110110                                                          | 001101
  7 | 111001                                                          | 001110
  8 | 110000                                                          | 001100
  9 | 100001                                                          | 001000
 10 | 100100101011001010010101000111110110101101101111011000101010    | 001001001010110010100101010001111101101011011011110110001010
 11 | 1001001010110010100101010001111101101011011011110110001010101   | 0010010010101100101001010100011111011010110110111101100010101
 12 | 10010010101100101001010100011111011010110110111101100010101010  | 00100100101011001010010101000111110110101101101111011000101010
 13 | 100100101011001010010101000111110110101101101111011000101010101 | 001001001010110010100101010001111101101011011011110110001010101
(13 rows)

--Testcase 256:
SELECT "i", "b", "b" << 3 "res" FROM "type_VARBIT";
 i  |                                b                                |                               res                               
----+-----------------------------------------------------------------+-----------------------------------------------------------------
  1 | 1                                                               | 0
  2 | 10                                                              | 00
  3 | 11                                                              | 00
  4 | 100                                                             | 000
  5 | 101                                                             | 000
  6 | 110110                                                          | 110000
  7 | 111001                                                          | 001000
  8 | 110000                                                          | 000000
  9 | 100001                                                          | 001000
 10 | 100100101011001010010101000111110110101101101111011000101010    | 100101011001010010101000111110110101101101111011000101010000
 11 | 1001001010110010100101010001111101101011011011110110001010101   | 1001010110010100101010001111101101011011011110110001010101000
 12 | 10010010101100101001010100011111011010110110111101100010101010  | 10010101100101001010100011111011010110110111101100010101010000
 13 | 100100101011001010010101000111110110101101101111011000101010101 | 100101011001010010101000111110110101101101111011000101010101000
(13 rows)

--Testcase 257:
SELECT "i", "b", ~ "b" "res" FROM "type_VARBIT";
 i  |                                b                                |                               res                               
----+-----------------------------------------------------------------+-----------------------------------------------------------------
  1 | 1                                                               | 0
  2 | 10                                                              | 01
  3 | 11                                                              | 00
  4 | 100                                                             | 011
  5 | 101                                                             | 010
  6 | 110110                                                          | 001001
  7 | 111001                                                          | 000110
  8 | 110000                                                          | 001111
  9 | 100001                                                          | 011110
 10 | 100100101011001010010101000111110110101101101111011000101010    | 011011010100110101101010111000001001010010010000100111010101
 11 | 1001001010110010100101010001111101101011011011110110001010101   | 0110110101001101011010101110000010010100100100001001110101010
 12 | 10010010101100101001010100011111011010110110111101100010101010  | 01101101010011010110101011100000100101001001000010011101010101
 13 | 100100101011001010010101000111110110101101101111011000101010101 | 011011010100110101101010111000001001010010010000100111010101010
(13 rows)

--Testcase 258:
EXPLAIN VERBOSE
SELECT b1."i" "i₁", b1."b" "b₁", b2."i" "i₂", b2."b" "b₂", b1."b" | b2."b" "res" FROM "type_VARBIT" b1 INNER JOIN "type_VARBIT" b2 ON true;
                                          QUERY PLAN                                           
-----------------------------------------------------------------------------------------------
 Nested Loop  (cost=20.00..53330.55 rows=3312400 width=74)
   Output: b1.i, b1.b, b2.i, b2.b, ((b1.b)::"bit" | (b2.b)::"bit")
   ->  Foreign Scan on public."type_VARBIT" b1  (cost=10.00..1820.00 rows=1820 width=21)
         Output: b1.i, b1.b
         SQLite query: SELECT `i`, `b` FROM main."type_VARBIT"
   ->  Materialize  (cost=10.00..1829.10 rows=1820 width=21)
         Output: b2.i, b2.b
         ->  Foreign Scan on public."type_VARBIT" b2  (cost=10.00..1820.00 rows=1820 width=21)
               Output: b2.i, b2.b
               SQLite query: SELECT `i`, `b` FROM main."type_VARBIT"
(10 rows)

--Testcase 259:
EXPLAIN VERBOSE
SELECT b1."i" "i₁", b1."b" "b₁", b2."i" "i₂", b2."b" "b₂", b1."b" & b2."b" "res" FROM "type_VARBIT" b1 INNER JOIN "type_VARBIT" b2 ON true;
                                          QUERY PLAN                                           
-----------------------------------------------------------------------------------------------
 Nested Loop  (cost=20.00..53330.55 rows=3312400 width=74)
   Output: b1.i, b1.b, b2.i, b2.b, ((b1.b)::"bit" & (b2.b)::"bit")
   ->  Foreign Scan on public."type_VARBIT" b1  (cost=10.00..1820.00 rows=1820 width=21)
         Output: b1.i, b1.b
         SQLite query: SELECT `i`, `b` FROM main."type_VARBIT"
   ->  Materialize  (cost=10.00..1829.10 rows=1820 width=21)
         Output: b2.i, b2.b
         ->  Foreign Scan on public."type_VARBIT" b2  (cost=10.00..1820.00 rows=1820 width=21)
               Output: b2.i, b2.b
               SQLite query: SELECT `i`, `b` FROM main."type_VARBIT"
(10 rows)

--Testcase 260:
EXPLAIN VERBOSE
SELECT b1."i" "i₁", b1."b" "b₁", b2."i" "i₂", b2."b" "b₂", b1."b" # b2."b" "res" FROM "type_VARBIT" b1 INNER JOIN "type_VARBIT" b2 ON true;
                                          QUERY PLAN                                           
-----------------------------------------------------------------------------------------------
 Nested Loop  (cost=20.00..53330.55 rows=3312400 width=74)
   Output: b1.i, b1.b, b2.i, b2.b, ((b1.b)::"bit" # (b2.b)::"bit")
   ->  Foreign Scan on public."type_VARBIT" b1  (cost=10.00..1820.00 rows=1820 width=21)
         Output: b1.i, b1.b
         SQLite query: SELECT `i`, `b` FROM main."type_VARBIT"
   ->  Materialize  (cost=10.00..1829.10 rows=1820 width=21)
         Output: b2.i, b2.b
         ->  Foreign Scan on public."type_VARBIT" b2  (cost=10.00..1820.00 rows=1820 width=21)
               Output: b2.i, b2.b
               SQLite query: SELECT `i`, `b` FROM main."type_VARBIT"
(10 rows)

--Testcase 261:
EXPLAIN VERBOSE
SELECT "i", "b", "b" >> 2 "res" FROM "type_VARBIT";
                                   QUERY PLAN                                   
--------------------------------------------------------------------------------
 Foreign Scan on public."type_VARBIT"  (cost=10.00..1824.55 rows=1820 width=53)
   Output: i, b, ((b)::"bit" >> 2)
   SQLite query: SELECT `i`, `b` FROM main."type_VARBIT"
(3 rows)

--Testcase 262:
EXPLAIN VERBOSE
SELECT "i", "b", "b" << 3 "res" FROM "type_VARBIT";
                                   QUERY PLAN                                   
--------------------------------------------------------------------------------
 Foreign Scan on public."type_VARBIT"  (cost=10.00..1824.55 rows=1820 width=53)
   Output: i, b, ((b)::"bit" << 3)
   SQLite query: SELECT `i`, `b` FROM main."type_VARBIT"
(3 rows)

--Testcase 263:
EXPLAIN VERBOSE
SELECT "i", "b", ~ "b" "res" FROM "type_VARBIT";
                                   QUERY PLAN                                   
--------------------------------------------------------------------------------
 Foreign Scan on public."type_VARBIT"  (cost=10.00..1824.55 rows=1820 width=53)
   Output: i, b, (~ (b)::"bit")
   SQLite query: SELECT `i`, `b` FROM main."type_VARBIT"
(3 rows)

--Testcase 47:
DROP EXTENSION sqlite_fdw CASCADE;
NOTICE:  drop cascades to 47 other objects
DETAIL:  drop cascades to server sqlite_svr
drop cascades to foreign table department
drop cascades to foreign table employee
drop cascades to foreign table empdata
drop cascades to foreign table numbers
drop cascades to foreign table t
drop cascades to foreign table multiprimary
drop cascades to foreign table columntest
drop cascades to foreign table noprimary
drop cascades to foreign table limittest
drop cascades to foreign table grem1_1
drop cascades to foreign table grem1_2
drop cascades to foreign table case_exp
drop cascades to foreign table "type_STRING"
drop cascades to foreign table "type_BYTE"
drop cascades to foreign table "type_SINT"
drop cascades to foreign table "type_BINT"
drop cascades to foreign table "type_INTEGER"
drop cascades to foreign table "type_FLOAT"
drop cascades to foreign table "type_DOUBLE"
drop cascades to foreign table "type_TIMESTAMP"
drop cascades to foreign table "type_BLOB"
drop cascades to foreign table "type_DATE"
drop cascades to foreign table "type_TIME"
drop cascades to foreign table "type_UUID"
drop cascades to foreign table "BitT"
drop cascades to foreign table notype
drop cascades to foreign table typetest
drop cascades to foreign table "type_TEXT"
drop cascades to foreign table alltypetest
drop cascades to foreign table shorty
drop cascades to foreign table "A a"
drop cascades to foreign table fts_table
drop cascades to foreign table fts_table_data
drop cascades to foreign table fts_table_idx
drop cascades to foreign table fts_table_content
drop cascades to foreign table fts_table_docsize
drop cascades to foreign table fts_table_config
drop cascades to foreign table "RO_RW_test"
drop cascades to foreign table "Unicode data"
drop cascades to foreign table type_json
drop cascades to foreign table "type_BOOLEAN"
drop cascades to foreign table "type_BIT"
drop cascades to foreign table "type_BIT+"
drop cascades to foreign table "type_VARBIT"
drop cascades to foreign table "type_VARBIT+"
drop cascades to server sqlite2
