--SET log_min_messages  TO DEBUG1;
--SET client_min_messages  TO DEBUG1;
--Testcase 001:
CREATE EXTENSION sqlite_fdw;
--Testcase 002:
CREATE SERVER sqlite_svr FOREIGN DATA WRAPPER sqlite_fdw
OPTIONS (database '/tmp/sqlite_fdw_test/common.db');
--Testcase 003:
CREATE SERVER sqlite2 FOREIGN DATA WRAPPER sqlite_fdw;
--Testcase 009:
CREATE FOREIGN TABLE "type_MACADDR8"( "i" int OPTIONS (key 'true'), "m" macaddr8) SERVER sqlite_svr OPTIONS (table 'type_MACADDR8');
--Testcase 010:
ALTER FOREIGN TABLE "type_MACADDR8" ALTER COLUMN "m" TYPE text;
--Testcase 011:
INSERT INTO "type_MACADDR8" ("i", "m") VALUES (1, '08:00:2b:01:02:03:04:05');
--Testcase 012:
INSERT INTO "type_MACADDR8" ("i", "m") VALUES (2, '08-00-2b-01-02-03-04-05');
--Testcase 013:
INSERT INTO "type_MACADDR8" ("i", "m") VALUES (3, '08002b01:02030405');
--Testcase 014:
INSERT INTO "type_MACADDR8" ("i", "m") VALUES (4, '08002b01-02030405');
--Testcase 015:
INSERT INTO "type_MACADDR8" ("i", "m") VALUES (5, '0800.2b01.0203.0405');
--Testcase 016:
INSERT INTO "type_MACADDR8" ("i", "m") VALUES (6, '0800-2b01-0203-0405');
--Testcase 017:
INSERT INTO "type_MACADDR8" ("i", "m") VALUES (7, '08002b0102030405');
--Testcase 018:
INSERT INTO "type_MACADDR8" ("i", "m") VALUES (8, '08:00:2F:01:02:03:04:05');
--Testcase 019:
INSERT INTO "type_MACADDR8" ("i", "m") VALUES (9, '08-00-2F-01-02-03-04-05');
--Testcase 020:
INSERT INTO "type_MACADDR8" ("i", "m") VALUES (10, '08002F01:02030405');
--Testcase 021:
INSERT INTO "type_MACADDR8" ("i", "m") VALUES (11, '08002F01-02030405');
--Testcase 022:
INSERT INTO "type_MACADDR8" ("i", "m") VALUES (12, '0800.2F01.0203.0405');
--Testcase 023:
INSERT INTO "type_MACADDR8" ("i", "m") VALUES (13, '0800-2F01-0203-0405');
--Testcase 024:
INSERT INTO "type_MACADDR8" ("i", "m") VALUES (14, '08002F0102030405');
--Testcase 025:
ALTER FOREIGN TABLE "type_MACADDR8" ALTER COLUMN "m" TYPE bytea;
--Testcase 026:
INSERT INTO "type_MACADDR8" ("i", "m") VALUES (15, decode('08002F0102030405', 'hex'));
--Testcase 027:
INSERT INTO "type_MACADDR8" ("i", "m") VALUES (16, decode('08002b0102030405', 'hex'));
--Testcase 028:
ALTER FOREIGN TABLE "type_MACADDR8" ALTER COLUMN "m" TYPE macaddr8;
--Testcase 029:
INSERT INTO "type_MACADDR8" ("i", "m") VALUES (17, '08:00:2b:01:02:03:04:05');
--Testcase 030:
INSERT INTO "type_MACADDR8" ("i", "m") VALUES (18, '08-00-2b-01-02-03-04-05');
--Testcase 031:
INSERT INTO "type_MACADDR8" ("i", "m") VALUES (19, '08002b01:02030405');
--Testcase 032:
INSERT INTO "type_MACADDR8" ("i", "m") VALUES (20, '08002b01-02030405');
--Testcase 033:
INSERT INTO "type_MACADDR8" ("i", "m") VALUES (21, '0800.2b01.0203.0405');
--Testcase 034:
INSERT INTO "type_MACADDR8" ("i", "m") VALUES (22, '0800-2b01-0203-0405');
--Testcase 035:
INSERT INTO "type_MACADDR8" ("i", "m") VALUES (23, '08002b0102030405');
--Testcase 036:
INSERT INTO "type_MACADDR8" ("i", "m") VALUES (24, '08:00:2F:01:02:03:04:05');
--Testcase 037:
INSERT INTO "type_MACADDR8" ("i", "m") VALUES (25, '08-00-2F-01-02-03-04-05');
--Testcase 038:
INSERT INTO "type_MACADDR8" ("i", "m") VALUES (26, '08002F01:02030405');
--Testcase 039:
INSERT INTO "type_MACADDR8" ("i", "m") VALUES (27, '08002F01-02030405');
--Testcase 040:
INSERT INTO "type_MACADDR8" ("i", "m") VALUES (28, '0800.2F01.0203.0405');
--Testcase 041:
INSERT INTO "type_MACADDR8" ("i", "m") VALUES (29, '0800-2F01-0203-0405');
--Testcase 042:
INSERT INTO "type_MACADDR8" ("i", "m") VALUES (30, '08002F0102030405');
--Testcase 043:
EXPLAIN (VERBOSE, COSTS OFF)
INSERT INTO "type_MACADDR8" ("i", "m") VALUES (30, '08002F0102030405');
                       QUERY PLAN                        
---------------------------------------------------------
 Insert on public."type_MACADDR8"
   Batch Size: 1
   ->  Result
         Output: 30, '08:00:2f:01:02:03:04:05'::macaddr8
(4 rows)

--Testcase 044:
ALTER FOREIGN TABLE "type_MACADDR8" ALTER COLUMN "m" OPTIONS (ADD column_type 'BLOB');
--Testcase 045:
INSERT INTO "type_MACADDR8" ("i", "m") VALUES (31, '08:00:2b:01:02:03:04:05');
--Testcase 046:
INSERT INTO "type_MACADDR8" ("i", "m") VALUES (32, '08-00-2b-01-02-03-04-05');
--Testcase 047:
INSERT INTO "type_MACADDR8" ("i", "m") VALUES (33, '08002b01:02030405');
--Testcase 048:
INSERT INTO "type_MACADDR8" ("i", "m") VALUES (34, '08002b01-02030405');
--Testcase 049:
INSERT INTO "type_MACADDR8" ("i", "m") VALUES (35, '0800.2b01.0203.0405');
--Testcase 050:
INSERT INTO "type_MACADDR8" ("i", "m") VALUES (36, '0800-2b01-0203-0405');
--Testcase 051:
INSERT INTO "type_MACADDR8" ("i", "m") VALUES (37, '08002b0102030405');
--Testcase 052:
INSERT INTO "type_MACADDR8" ("i", "m") VALUES (38, '08:00:2F:01:02:03:04:05');
--Testcase 053:
INSERT INTO "type_MACADDR8" ("i", "m") VALUES (39, '08-00-2F-01-02-03-04-05');
--Testcase 054:
INSERT INTO "type_MACADDR8" ("i", "m") VALUES (40, '08002F01:02030405');
--Testcase 055:
INSERT INTO "type_MACADDR8" ("i", "m") VALUES (41, '08002F01-02030405');
--Testcase 056:
INSERT INTO "type_MACADDR8" ("i", "m") VALUES (42, '0800.2F01.0203.0405');
--Testcase 057:
INSERT INTO "type_MACADDR8" ("i", "m") VALUES (43, '0800-2F01-0203-0405');
--Testcase 058:
INSERT INTO "type_MACADDR8" ("i", "m") VALUES (44, '08002F0102030405');
--Testcase 059:
EXPLAIN (VERBOSE, COSTS OFF)
INSERT INTO "type_MACADDR8" ("i", "m") VALUES (44, '08002F0102030405');
                       QUERY PLAN                        
---------------------------------------------------------
 Insert on public."type_MACADDR8"
   Batch Size: 1
   ->  Result
         Output: 44, '08:00:2f:01:02:03:04:05'::macaddr8
(4 rows)

--Testcase 060:
ALTER FOREIGN TABLE "type_MACADDR8" ALTER COLUMN "m" OPTIONS (SET column_type 'text');
--Testcase 061:
INSERT INTO "type_MACADDR8" ("i", "m") VALUES (45, '08:00:2b:01:02:03:04:05');
--Testcase 062:
INSERT INTO "type_MACADDR8" ("i", "m") VALUES (46, '08-00-2b-01-02-03-04-05');
--Testcase 063:
INSERT INTO "type_MACADDR8" ("i", "m") VALUES (47, '08002b01:02030405');
--Testcase 064:
INSERT INTO "type_MACADDR8" ("i", "m") VALUES (48, '08002b01-02030405');
--Testcase 065:
INSERT INTO "type_MACADDR8" ("i", "m") VALUES (49, '0800.2b01.0203.0405');
--Testcase 066:
INSERT INTO "type_MACADDR8" ("i", "m") VALUES (50, '0800-2b01-0203-0405');
--Testcase 067:
INSERT INTO "type_MACADDR8" ("i", "m") VALUES (51, '08002b0102030405');
--Testcase 068:
INSERT INTO "type_MACADDR8" ("i", "m") VALUES (52, '08:00:2F:01:02:03:04:05');
--Testcase 069:
INSERT INTO "type_MACADDR8" ("i", "m") VALUES (53, '08-00-2F-01-02-03-04-05');
--Testcase 070:
INSERT INTO "type_MACADDR8" ("i", "m") VALUES (54, '08002F01:02030405');
--Testcase 071:
INSERT INTO "type_MACADDR8" ("i", "m") VALUES (55, '08002F01-02030405');
--Testcase 072:
INSERT INTO "type_MACADDR8" ("i", "m") VALUES (56, '0800.2F01.0203.0405');
--Testcase 073:
INSERT INTO "type_MACADDR8" ("i", "m") VALUES (57, '0800-2F01-0203-0405');
--Testcase 074:
INSERT INTO "type_MACADDR8" ("i", "m") VALUES (58, '08002F0102030405');
--Testcase 075:
EXPLAIN (VERBOSE, COSTS OFF)
INSERT INTO "type_MACADDR8" ("i", "m") VALUES (58, '08002F0102030405');
                       QUERY PLAN                        
---------------------------------------------------------
 Insert on public."type_MACADDR8"
   Batch Size: 1
   ->  Result
         Output: 58, '08:00:2f:01:02:03:04:05'::macaddr8
(4 rows)

--Testcase 076:
CREATE FOREIGN TABLE "type_MACADDR8+"( "i" int OPTIONS (key 'true'), "m" macaddr8, "t" text, "l" smallint, "tx" varchar(64)) SERVER sqlite_svr OPTIONS (table 'type_MACADDR8+');
--Testcase 077:
SELECT * FROM "type_MACADDR8+";
 i  |            m            |    t    | l  |           tx            
----+-------------------------+---------+----+-------------------------
  1 | 08:00:2b:01:02:03:04:05 | text    | 23 | 08:00:2b:01:02:03:04:05
  2 | 08:00:2b:01:02:03:04:05 | text    | 23 | 08-00-2b-01-02-03-04-05
  3 | 08:00:2b:01:02:03:04:05 | text    | 17 | 08002b01:02030405
  4 | 08:00:2b:01:02:03:04:05 | text    | 17 | 08002b01-02030405
  5 | 08:00:2b:01:02:03:04:05 | text    | 19 | 0800.2b01.0203.0405
  6 | 08:00:2b:01:02:03:04:05 | text    | 19 | 0800-2b01-0203-0405
  7 | 08:00:2b:01:02:03:04:05 | text    | 16 | 08002b0102030405
  8 | 08:00:2f:01:02:03:04:05 | text    | 23 | 08:00:2F:01:02:03:04:05
  9 | 08:00:2f:01:02:03:04:05 | text    | 23 | 08-00-2F-01-02-03-04-05
 10 | 08:00:2f:01:02:03:04:05 | text    | 17 | 08002F01:02030405
 11 | 08:00:2f:01:02:03:04:05 | text    | 17 | 08002F01-02030405
 12 | 08:00:2f:01:02:03:04:05 | text    | 19 | 0800.2F01.0203.0405
 13 | 08:00:2f:01:02:03:04:05 | text    | 19 | 0800-2F01-0203-0405
 14 | 08:00:2f:01:02:03:04:05 | text    | 16 | 08002F0102030405
 15 | 08:00:2f:01:02:03:04:05 | blob    |  8 | \x08
 16 | 08:00:2b:01:02:03:04:05 | blob    |  8 | \x08
 17 | 08:00:2b:01:02:03:04:05 | integer | 18 | 576508035632137221
 18 | 08:00:2b:01:02:03:04:05 | integer | 18 | 576508035632137221
 19 | 08:00:2b:01:02:03:04:05 | integer | 18 | 576508035632137221
 20 | 08:00:2b:01:02:03:04:05 | integer | 18 | 576508035632137221
 21 | 08:00:2b:01:02:03:04:05 | integer | 18 | 576508035632137221
 22 | 08:00:2b:01:02:03:04:05 | integer | 18 | 576508035632137221
 23 | 08:00:2b:01:02:03:04:05 | integer | 18 | 576508035632137221
 24 | 08:00:2f:01:02:03:04:05 | integer | 18 | 576512433678648325
 25 | 08:00:2f:01:02:03:04:05 | integer | 18 | 576512433678648325
 26 | 08:00:2f:01:02:03:04:05 | integer | 18 | 576512433678648325
 27 | 08:00:2f:01:02:03:04:05 | integer | 18 | 576512433678648325
 28 | 08:00:2f:01:02:03:04:05 | integer | 18 | 576512433678648325
 29 | 08:00:2f:01:02:03:04:05 | integer | 18 | 576512433678648325
 30 | 08:00:2f:01:02:03:04:05 | integer | 18 | 576512433678648325
 31 | 08:00:2b:01:02:03:04:05 | blob    |  8 | \x08
 32 | 08:00:2b:01:02:03:04:05 | blob    |  8 | \x08
 33 | 08:00:2b:01:02:03:04:05 | blob    |  8 | \x08
 34 | 08:00:2b:01:02:03:04:05 | blob    |  8 | \x08
 35 | 08:00:2b:01:02:03:04:05 | blob    |  8 | \x08
 36 | 08:00:2b:01:02:03:04:05 | blob    |  8 | \x08
 37 | 08:00:2b:01:02:03:04:05 | blob    |  8 | \x08
 38 | 08:00:2f:01:02:03:04:05 | blob    |  8 | \x08
 39 | 08:00:2f:01:02:03:04:05 | blob    |  8 | \x08
 40 | 08:00:2f:01:02:03:04:05 | blob    |  8 | \x08
 41 | 08:00:2f:01:02:03:04:05 | blob    |  8 | \x08
 42 | 08:00:2f:01:02:03:04:05 | blob    |  8 | \x08
 43 | 08:00:2f:01:02:03:04:05 | blob    |  8 | \x08
 44 | 08:00:2f:01:02:03:04:05 | blob    |  8 | \x08
 45 | 08:00:2b:01:02:03:04:05 | text    | 23 | 08:00:2b:01:02:03:04:05
 46 | 08:00:2b:01:02:03:04:05 | text    | 23 | 08:00:2b:01:02:03:04:05
 47 | 08:00:2b:01:02:03:04:05 | text    | 23 | 08:00:2b:01:02:03:04:05
 48 | 08:00:2b:01:02:03:04:05 | text    | 23 | 08:00:2b:01:02:03:04:05
 49 | 08:00:2b:01:02:03:04:05 | text    | 23 | 08:00:2b:01:02:03:04:05
 50 | 08:00:2b:01:02:03:04:05 | text    | 23 | 08:00:2b:01:02:03:04:05
 51 | 08:00:2b:01:02:03:04:05 | text    | 23 | 08:00:2b:01:02:03:04:05
 52 | 08:00:2f:01:02:03:04:05 | text    | 23 | 08:00:2f:01:02:03:04:05
 53 | 08:00:2f:01:02:03:04:05 | text    | 23 | 08:00:2f:01:02:03:04:05
 54 | 08:00:2f:01:02:03:04:05 | text    | 23 | 08:00:2f:01:02:03:04:05
 55 | 08:00:2f:01:02:03:04:05 | text    | 23 | 08:00:2f:01:02:03:04:05
 56 | 08:00:2f:01:02:03:04:05 | text    | 23 | 08:00:2f:01:02:03:04:05
 57 | 08:00:2f:01:02:03:04:05 | text    | 23 | 08:00:2f:01:02:03:04:05
 58 | 08:00:2f:01:02:03:04:05 | text    | 23 | 08:00:2f:01:02:03:04:05
(58 rows)

--Testcase 078:
ALTER FOREIGN TABLE "type_MACADDR8" ALTER COLUMN "m" OPTIONS (SET column_type 'BLOB');
--Testcase 079:
SELECT * FROM "type_MACADDR8+" where "m" = '08:00:2b:01:02:03:04:05';
 i  |            m            |    t    | l  |           tx            
----+-------------------------+---------+----+-------------------------
  1 | 08:00:2b:01:02:03:04:05 | text    | 23 | 08:00:2b:01:02:03:04:05
  2 | 08:00:2b:01:02:03:04:05 | text    | 23 | 08-00-2b-01-02-03-04-05
  3 | 08:00:2b:01:02:03:04:05 | text    | 17 | 08002b01:02030405
  4 | 08:00:2b:01:02:03:04:05 | text    | 17 | 08002b01-02030405
  5 | 08:00:2b:01:02:03:04:05 | text    | 19 | 0800.2b01.0203.0405
  6 | 08:00:2b:01:02:03:04:05 | text    | 19 | 0800-2b01-0203-0405
  7 | 08:00:2b:01:02:03:04:05 | text    | 16 | 08002b0102030405
 16 | 08:00:2b:01:02:03:04:05 | blob    |  8 | \x08
 17 | 08:00:2b:01:02:03:04:05 | integer | 18 | 576508035632137221
 18 | 08:00:2b:01:02:03:04:05 | integer | 18 | 576508035632137221
 19 | 08:00:2b:01:02:03:04:05 | integer | 18 | 576508035632137221
 20 | 08:00:2b:01:02:03:04:05 | integer | 18 | 576508035632137221
 21 | 08:00:2b:01:02:03:04:05 | integer | 18 | 576508035632137221
 22 | 08:00:2b:01:02:03:04:05 | integer | 18 | 576508035632137221
 23 | 08:00:2b:01:02:03:04:05 | integer | 18 | 576508035632137221
 31 | 08:00:2b:01:02:03:04:05 | blob    |  8 | \x08
 32 | 08:00:2b:01:02:03:04:05 | blob    |  8 | \x08
 33 | 08:00:2b:01:02:03:04:05 | blob    |  8 | \x08
 34 | 08:00:2b:01:02:03:04:05 | blob    |  8 | \x08
 35 | 08:00:2b:01:02:03:04:05 | blob    |  8 | \x08
 36 | 08:00:2b:01:02:03:04:05 | blob    |  8 | \x08
 37 | 08:00:2b:01:02:03:04:05 | blob    |  8 | \x08
 45 | 08:00:2b:01:02:03:04:05 | text    | 23 | 08:00:2b:01:02:03:04:05
 46 | 08:00:2b:01:02:03:04:05 | text    | 23 | 08:00:2b:01:02:03:04:05
 47 | 08:00:2b:01:02:03:04:05 | text    | 23 | 08:00:2b:01:02:03:04:05
 48 | 08:00:2b:01:02:03:04:05 | text    | 23 | 08:00:2b:01:02:03:04:05
 49 | 08:00:2b:01:02:03:04:05 | text    | 23 | 08:00:2b:01:02:03:04:05
 50 | 08:00:2b:01:02:03:04:05 | text    | 23 | 08:00:2b:01:02:03:04:05
 51 | 08:00:2b:01:02:03:04:05 | text    | 23 | 08:00:2b:01:02:03:04:05
(29 rows)

--Testcase 080:
EXPLAIN (VERBOSE, COSTS OFF)
SELECT * FROM "type_MACADDR8+" where "m" = '08:00:2b:01:02:03:04:05';
                                                                             QUERY PLAN                                                                              
---------------------------------------------------------------------------------------------------------------------------------------------------------------------
 Foreign Scan on public."type_MACADDR8+"
   Output: i, m, t, l, tx
   SQLite query: SELECT `i`, sqlite_fdw_macaddr_int(`m`, 8), `t`, `l`, `tx` FROM main."type_MACADDR8+" WHERE ((sqlite_fdw_macaddr_int(`m`, 8) = 0x08002b0102030405))
(3 rows)

--Testcase 081:
ALTER FOREIGN TABLE "type_MACADDR8" ALTER COLUMN "m" OPTIONS (SET column_type 'TEXT');
--Testcase 082:
SELECT * FROM "type_MACADDR8+" where "m" = '08:00:2b:01:02:03:04:05';
 i  |            m            |    t    | l  |           tx            
----+-------------------------+---------+----+-------------------------
  1 | 08:00:2b:01:02:03:04:05 | text    | 23 | 08:00:2b:01:02:03:04:05
  2 | 08:00:2b:01:02:03:04:05 | text    | 23 | 08-00-2b-01-02-03-04-05
  3 | 08:00:2b:01:02:03:04:05 | text    | 17 | 08002b01:02030405
  4 | 08:00:2b:01:02:03:04:05 | text    | 17 | 08002b01-02030405
  5 | 08:00:2b:01:02:03:04:05 | text    | 19 | 0800.2b01.0203.0405
  6 | 08:00:2b:01:02:03:04:05 | text    | 19 | 0800-2b01-0203-0405
  7 | 08:00:2b:01:02:03:04:05 | text    | 16 | 08002b0102030405
 16 | 08:00:2b:01:02:03:04:05 | blob    |  8 | \x08
 17 | 08:00:2b:01:02:03:04:05 | integer | 18 | 576508035632137221
 18 | 08:00:2b:01:02:03:04:05 | integer | 18 | 576508035632137221
 19 | 08:00:2b:01:02:03:04:05 | integer | 18 | 576508035632137221
 20 | 08:00:2b:01:02:03:04:05 | integer | 18 | 576508035632137221
 21 | 08:00:2b:01:02:03:04:05 | integer | 18 | 576508035632137221
 22 | 08:00:2b:01:02:03:04:05 | integer | 18 | 576508035632137221
 23 | 08:00:2b:01:02:03:04:05 | integer | 18 | 576508035632137221
 31 | 08:00:2b:01:02:03:04:05 | blob    |  8 | \x08
 32 | 08:00:2b:01:02:03:04:05 | blob    |  8 | \x08
 33 | 08:00:2b:01:02:03:04:05 | blob    |  8 | \x08
 34 | 08:00:2b:01:02:03:04:05 | blob    |  8 | \x08
 35 | 08:00:2b:01:02:03:04:05 | blob    |  8 | \x08
 36 | 08:00:2b:01:02:03:04:05 | blob    |  8 | \x08
 37 | 08:00:2b:01:02:03:04:05 | blob    |  8 | \x08
 45 | 08:00:2b:01:02:03:04:05 | text    | 23 | 08:00:2b:01:02:03:04:05
 46 | 08:00:2b:01:02:03:04:05 | text    | 23 | 08:00:2b:01:02:03:04:05
 47 | 08:00:2b:01:02:03:04:05 | text    | 23 | 08:00:2b:01:02:03:04:05
 48 | 08:00:2b:01:02:03:04:05 | text    | 23 | 08:00:2b:01:02:03:04:05
 49 | 08:00:2b:01:02:03:04:05 | text    | 23 | 08:00:2b:01:02:03:04:05
 50 | 08:00:2b:01:02:03:04:05 | text    | 23 | 08:00:2b:01:02:03:04:05
 51 | 08:00:2b:01:02:03:04:05 | text    | 23 | 08:00:2b:01:02:03:04:05
(29 rows)

--Testcase 083:
EXPLAIN (VERBOSE, COSTS OFF)
SELECT * FROM "type_MACADDR8+" where "m" = '08:00:2b:01:02:03:04:05';
                                                                             QUERY PLAN                                                                              
---------------------------------------------------------------------------------------------------------------------------------------------------------------------
 Foreign Scan on public."type_MACADDR8+"
   Output: i, m, t, l, tx
   SQLite query: SELECT `i`, sqlite_fdw_macaddr_int(`m`, 8), `t`, `l`, `tx` FROM main."type_MACADDR8+" WHERE ((sqlite_fdw_macaddr_int(`m`, 8) = 0x08002b0102030405))
(3 rows)

--Testcase 084:
SELECT * FROM "type_MACADDR8+" where "m" = '08:00:2F:01:02:03:04:05';
 i  |            m            |    t    | l  |           tx            
----+-------------------------+---------+----+-------------------------
  8 | 08:00:2f:01:02:03:04:05 | text    | 23 | 08:00:2F:01:02:03:04:05
  9 | 08:00:2f:01:02:03:04:05 | text    | 23 | 08-00-2F-01-02-03-04-05
 10 | 08:00:2f:01:02:03:04:05 | text    | 17 | 08002F01:02030405
 11 | 08:00:2f:01:02:03:04:05 | text    | 17 | 08002F01-02030405
 12 | 08:00:2f:01:02:03:04:05 | text    | 19 | 0800.2F01.0203.0405
 13 | 08:00:2f:01:02:03:04:05 | text    | 19 | 0800-2F01-0203-0405
 14 | 08:00:2f:01:02:03:04:05 | text    | 16 | 08002F0102030405
 15 | 08:00:2f:01:02:03:04:05 | blob    |  8 | \x08
 24 | 08:00:2f:01:02:03:04:05 | integer | 18 | 576512433678648325
 25 | 08:00:2f:01:02:03:04:05 | integer | 18 | 576512433678648325
 26 | 08:00:2f:01:02:03:04:05 | integer | 18 | 576512433678648325
 27 | 08:00:2f:01:02:03:04:05 | integer | 18 | 576512433678648325
 28 | 08:00:2f:01:02:03:04:05 | integer | 18 | 576512433678648325
 29 | 08:00:2f:01:02:03:04:05 | integer | 18 | 576512433678648325
 30 | 08:00:2f:01:02:03:04:05 | integer | 18 | 576512433678648325
 38 | 08:00:2f:01:02:03:04:05 | blob    |  8 | \x08
 39 | 08:00:2f:01:02:03:04:05 | blob    |  8 | \x08
 40 | 08:00:2f:01:02:03:04:05 | blob    |  8 | \x08
 41 | 08:00:2f:01:02:03:04:05 | blob    |  8 | \x08
 42 | 08:00:2f:01:02:03:04:05 | blob    |  8 | \x08
 43 | 08:00:2f:01:02:03:04:05 | blob    |  8 | \x08
 44 | 08:00:2f:01:02:03:04:05 | blob    |  8 | \x08
 52 | 08:00:2f:01:02:03:04:05 | text    | 23 | 08:00:2f:01:02:03:04:05
 53 | 08:00:2f:01:02:03:04:05 | text    | 23 | 08:00:2f:01:02:03:04:05
 54 | 08:00:2f:01:02:03:04:05 | text    | 23 | 08:00:2f:01:02:03:04:05
 55 | 08:00:2f:01:02:03:04:05 | text    | 23 | 08:00:2f:01:02:03:04:05
 56 | 08:00:2f:01:02:03:04:05 | text    | 23 | 08:00:2f:01:02:03:04:05
 57 | 08:00:2f:01:02:03:04:05 | text    | 23 | 08:00:2f:01:02:03:04:05
 58 | 08:00:2f:01:02:03:04:05 | text    | 23 | 08:00:2f:01:02:03:04:05
(29 rows)

--Testcase 085:
ALTER FOREIGN TABLE "type_MACADDR8" ALTER COLUMN "m" OPTIONS (SET column_type 'integer');
--Testcase 086:
SELECT * FROM "type_MACADDR8+" where "m" = '08:00:2b:01:02:03:04:05';
 i  |            m            |    t    | l  |           tx            
----+-------------------------+---------+----+-------------------------
  1 | 08:00:2b:01:02:03:04:05 | text    | 23 | 08:00:2b:01:02:03:04:05
  2 | 08:00:2b:01:02:03:04:05 | text    | 23 | 08-00-2b-01-02-03-04-05
  3 | 08:00:2b:01:02:03:04:05 | text    | 17 | 08002b01:02030405
  4 | 08:00:2b:01:02:03:04:05 | text    | 17 | 08002b01-02030405
  5 | 08:00:2b:01:02:03:04:05 | text    | 19 | 0800.2b01.0203.0405
  6 | 08:00:2b:01:02:03:04:05 | text    | 19 | 0800-2b01-0203-0405
  7 | 08:00:2b:01:02:03:04:05 | text    | 16 | 08002b0102030405
 16 | 08:00:2b:01:02:03:04:05 | blob    |  8 | \x08
 17 | 08:00:2b:01:02:03:04:05 | integer | 18 | 576508035632137221
 18 | 08:00:2b:01:02:03:04:05 | integer | 18 | 576508035632137221
 19 | 08:00:2b:01:02:03:04:05 | integer | 18 | 576508035632137221
 20 | 08:00:2b:01:02:03:04:05 | integer | 18 | 576508035632137221
 21 | 08:00:2b:01:02:03:04:05 | integer | 18 | 576508035632137221
 22 | 08:00:2b:01:02:03:04:05 | integer | 18 | 576508035632137221
 23 | 08:00:2b:01:02:03:04:05 | integer | 18 | 576508035632137221
 31 | 08:00:2b:01:02:03:04:05 | blob    |  8 | \x08
 32 | 08:00:2b:01:02:03:04:05 | blob    |  8 | \x08
 33 | 08:00:2b:01:02:03:04:05 | blob    |  8 | \x08
 34 | 08:00:2b:01:02:03:04:05 | blob    |  8 | \x08
 35 | 08:00:2b:01:02:03:04:05 | blob    |  8 | \x08
 36 | 08:00:2b:01:02:03:04:05 | blob    |  8 | \x08
 37 | 08:00:2b:01:02:03:04:05 | blob    |  8 | \x08
 45 | 08:00:2b:01:02:03:04:05 | text    | 23 | 08:00:2b:01:02:03:04:05
 46 | 08:00:2b:01:02:03:04:05 | text    | 23 | 08:00:2b:01:02:03:04:05
 47 | 08:00:2b:01:02:03:04:05 | text    | 23 | 08:00:2b:01:02:03:04:05
 48 | 08:00:2b:01:02:03:04:05 | text    | 23 | 08:00:2b:01:02:03:04:05
 49 | 08:00:2b:01:02:03:04:05 | text    | 23 | 08:00:2b:01:02:03:04:05
 50 | 08:00:2b:01:02:03:04:05 | text    | 23 | 08:00:2b:01:02:03:04:05
 51 | 08:00:2b:01:02:03:04:05 | text    | 23 | 08:00:2b:01:02:03:04:05
(29 rows)

--Testcase 087:
EXPLAIN (VERBOSE, COSTS OFF)
SELECT * FROM "type_MACADDR8+" where "m" = '08:00:2b:01:02:03:04:05';
                                                                             QUERY PLAN                                                                              
---------------------------------------------------------------------------------------------------------------------------------------------------------------------
 Foreign Scan on public."type_MACADDR8+"
   Output: i, m, t, l, tx
   SQLite query: SELECT `i`, sqlite_fdw_macaddr_int(`m`, 8), `t`, `l`, `tx` FROM main."type_MACADDR8+" WHERE ((sqlite_fdw_macaddr_int(`m`, 8) = 0x08002b0102030405))
(3 rows)

--Testcase 088:
SELECT * FROM "type_MACADDR8+" where "m" = '08:00:2F:01:02:03:04:05';
 i  |            m            |    t    | l  |           tx            
----+-------------------------+---------+----+-------------------------
  8 | 08:00:2f:01:02:03:04:05 | text    | 23 | 08:00:2F:01:02:03:04:05
  9 | 08:00:2f:01:02:03:04:05 | text    | 23 | 08-00-2F-01-02-03-04-05
 10 | 08:00:2f:01:02:03:04:05 | text    | 17 | 08002F01:02030405
 11 | 08:00:2f:01:02:03:04:05 | text    | 17 | 08002F01-02030405
 12 | 08:00:2f:01:02:03:04:05 | text    | 19 | 0800.2F01.0203.0405
 13 | 08:00:2f:01:02:03:04:05 | text    | 19 | 0800-2F01-0203-0405
 14 | 08:00:2f:01:02:03:04:05 | text    | 16 | 08002F0102030405
 15 | 08:00:2f:01:02:03:04:05 | blob    |  8 | \x08
 24 | 08:00:2f:01:02:03:04:05 | integer | 18 | 576512433678648325
 25 | 08:00:2f:01:02:03:04:05 | integer | 18 | 576512433678648325
 26 | 08:00:2f:01:02:03:04:05 | integer | 18 | 576512433678648325
 27 | 08:00:2f:01:02:03:04:05 | integer | 18 | 576512433678648325
 28 | 08:00:2f:01:02:03:04:05 | integer | 18 | 576512433678648325
 29 | 08:00:2f:01:02:03:04:05 | integer | 18 | 576512433678648325
 30 | 08:00:2f:01:02:03:04:05 | integer | 18 | 576512433678648325
 38 | 08:00:2f:01:02:03:04:05 | blob    |  8 | \x08
 39 | 08:00:2f:01:02:03:04:05 | blob    |  8 | \x08
 40 | 08:00:2f:01:02:03:04:05 | blob    |  8 | \x08
 41 | 08:00:2f:01:02:03:04:05 | blob    |  8 | \x08
 42 | 08:00:2f:01:02:03:04:05 | blob    |  8 | \x08
 43 | 08:00:2f:01:02:03:04:05 | blob    |  8 | \x08
 44 | 08:00:2f:01:02:03:04:05 | blob    |  8 | \x08
 52 | 08:00:2f:01:02:03:04:05 | text    | 23 | 08:00:2f:01:02:03:04:05
 53 | 08:00:2f:01:02:03:04:05 | text    | 23 | 08:00:2f:01:02:03:04:05
 54 | 08:00:2f:01:02:03:04:05 | text    | 23 | 08:00:2f:01:02:03:04:05
 55 | 08:00:2f:01:02:03:04:05 | text    | 23 | 08:00:2f:01:02:03:04:05
 56 | 08:00:2f:01:02:03:04:05 | text    | 23 | 08:00:2f:01:02:03:04:05
 57 | 08:00:2f:01:02:03:04:05 | text    | 23 | 08:00:2f:01:02:03:04:05
 58 | 08:00:2f:01:02:03:04:05 | text    | 23 | 08:00:2f:01:02:03:04:05
(29 rows)

--Testcase 089:
ALTER FOREIGN TABLE "type_MACADDR8" ALTER COLUMN "m" OPTIONS (SET column_type 'BLOB');
--Testcase 090:
SELECT * FROM "type_MACADDR8+" where "m" = '08:00:2F:01:02:03:04:05';
 i  |            m            |    t    | l  |           tx            
----+-------------------------+---------+----+-------------------------
  8 | 08:00:2f:01:02:03:04:05 | text    | 23 | 08:00:2F:01:02:03:04:05
  9 | 08:00:2f:01:02:03:04:05 | text    | 23 | 08-00-2F-01-02-03-04-05
 10 | 08:00:2f:01:02:03:04:05 | text    | 17 | 08002F01:02030405
 11 | 08:00:2f:01:02:03:04:05 | text    | 17 | 08002F01-02030405
 12 | 08:00:2f:01:02:03:04:05 | text    | 19 | 0800.2F01.0203.0405
 13 | 08:00:2f:01:02:03:04:05 | text    | 19 | 0800-2F01-0203-0405
 14 | 08:00:2f:01:02:03:04:05 | text    | 16 | 08002F0102030405
 15 | 08:00:2f:01:02:03:04:05 | blob    |  8 | \x08
 24 | 08:00:2f:01:02:03:04:05 | integer | 18 | 576512433678648325
 25 | 08:00:2f:01:02:03:04:05 | integer | 18 | 576512433678648325
 26 | 08:00:2f:01:02:03:04:05 | integer | 18 | 576512433678648325
 27 | 08:00:2f:01:02:03:04:05 | integer | 18 | 576512433678648325
 28 | 08:00:2f:01:02:03:04:05 | integer | 18 | 576512433678648325
 29 | 08:00:2f:01:02:03:04:05 | integer | 18 | 576512433678648325
 30 | 08:00:2f:01:02:03:04:05 | integer | 18 | 576512433678648325
 38 | 08:00:2f:01:02:03:04:05 | blob    |  8 | \x08
 39 | 08:00:2f:01:02:03:04:05 | blob    |  8 | \x08
 40 | 08:00:2f:01:02:03:04:05 | blob    |  8 | \x08
 41 | 08:00:2f:01:02:03:04:05 | blob    |  8 | \x08
 42 | 08:00:2f:01:02:03:04:05 | blob    |  8 | \x08
 43 | 08:00:2f:01:02:03:04:05 | blob    |  8 | \x08
 44 | 08:00:2f:01:02:03:04:05 | blob    |  8 | \x08
 52 | 08:00:2f:01:02:03:04:05 | text    | 23 | 08:00:2f:01:02:03:04:05
 53 | 08:00:2f:01:02:03:04:05 | text    | 23 | 08:00:2f:01:02:03:04:05
 54 | 08:00:2f:01:02:03:04:05 | text    | 23 | 08:00:2f:01:02:03:04:05
 55 | 08:00:2f:01:02:03:04:05 | text    | 23 | 08:00:2f:01:02:03:04:05
 56 | 08:00:2f:01:02:03:04:05 | text    | 23 | 08:00:2f:01:02:03:04:05
 57 | 08:00:2f:01:02:03:04:05 | text    | 23 | 08:00:2f:01:02:03:04:05
 58 | 08:00:2f:01:02:03:04:05 | text    | 23 | 08:00:2f:01:02:03:04:05
(29 rows)

--Testcase 091:
UPDATE "type_MACADDR8" SET "m" = '08:AA:2F:01:02:03:04:05' WHERE "i" = 15;
--Testcase 092:
EXPLAIN (VERBOSE, COSTS OFF)
UPDATE "type_MACADDR8" SET "m" = '08:AA:2F:01:02:03:04:05' WHERE "i" = 15;
                                                          QUERY PLAN                                                           
-------------------------------------------------------------------------------------------------------------------------------
 Update on public."type_MACADDR8"
   ->  Foreign Update on public."type_MACADDR8"
         SQLite query: UPDATE main."type_MACADDR8" SET `m` = sqlite_fdw_macaddr_blob(0x08aa2f0102030405, 8) WHERE ((`i` = 15))
(3 rows)

--Testcase 093:
ALTER FOREIGN TABLE "type_MACADDR8" ALTER COLUMN "m" OPTIONS (SET column_type 'TEXT');
--Testcase 094:
EXPLAIN (VERBOSE, COSTS OFF)
UPDATE "type_MACADDR8" SET "m" = '08:AA:2F:01:02:03:04:05' WHERE "i" = 16;
                                                          QUERY PLAN                                                          
------------------------------------------------------------------------------------------------------------------------------
 Update on public."type_MACADDR8"
   ->  Foreign Update on public."type_MACADDR8"
         SQLite query: UPDATE main."type_MACADDR8" SET `m` = sqlite_fdw_macaddr_str(0x08aa2f0102030405, 8) WHERE ((`i` = 16))
(3 rows)

--Testcase 095:
UPDATE "type_MACADDR8" SET "m" = '08:AA:2F:01:02:03:04:05' WHERE "i" = 16;
--Testcase 096:
ALTER FOREIGN TABLE "type_MACADDR8" ALTER COLUMN "m" OPTIONS (SET column_type 'integer');
--Testcase 097:
EXPLAIN (VERBOSE, COSTS OFF)
UPDATE "type_MACADDR8" SET "m" = '08:AA:2F:01:02:03:04:05' WHERE "i" = 17;
                                            QUERY PLAN                                             
---------------------------------------------------------------------------------------------------
 Update on public."type_MACADDR8"
   ->  Foreign Update on public."type_MACADDR8"
         SQLite query: UPDATE main."type_MACADDR8" SET `m` = 0x08aa2f0102030405 WHERE ((`i` = 17))
(3 rows)

--Testcase 098:
UPDATE "type_MACADDR8" SET "m" = '08:AA:2F:01:02:03:04:05' WHERE "i" = 17;
--Testcase 099:
ALTER FOREIGN TABLE "type_MACADDR8" ALTER COLUMN "m" OPTIONS (SET column_type 'BLOB');
--Testcase 100:
DELETE FROM "type_MACADDR8" WHERE "m" = '08:00:2F:01:02:03:04:05';
--Testcase 101:
EXPLAIN (VERBOSE, COSTS OFF)
DELETE FROM "type_MACADDR8" WHERE "m" = '08:00:2F:01:02:03:04:05';
                                                      QUERY PLAN                                                      
----------------------------------------------------------------------------------------------------------------------
 Delete on public."type_MACADDR8"
   ->  Foreign Delete on public."type_MACADDR8"
         SQLite query: DELETE FROM main."type_MACADDR8" WHERE ((sqlite_fdw_macaddr_int(`m`, 8) = 0x08002f0102030405))
(3 rows)

--Testcase 102:
ALTER FOREIGN TABLE "type_MACADDR8" ALTER COLUMN "m" OPTIONS (SET column_type 'integer');
--Testcase 103:
EXPLAIN (VERBOSE, COSTS OFF)
DELETE FROM "type_MACADDR8" WHERE "m" = '08:00:2F:01:02:03:04:05';
                                                      QUERY PLAN                                                      
----------------------------------------------------------------------------------------------------------------------
 Delete on public."type_MACADDR8"
   ->  Foreign Delete on public."type_MACADDR8"
         SQLite query: DELETE FROM main."type_MACADDR8" WHERE ((sqlite_fdw_macaddr_int(`m`, 8) = 0x08002f0102030405))
(3 rows)

--Testcase 104:
ALTER FOREIGN TABLE "type_MACADDR8" ALTER COLUMN "m" OPTIONS (SET column_type 'TEXT');
--Testcase 105:
EXPLAIN (VERBOSE, COSTS OFF)
DELETE FROM "type_MACADDR8" WHERE "m" = '08:00:2F:01:02:03:04:05';
                                                      QUERY PLAN                                                      
----------------------------------------------------------------------------------------------------------------------
 Delete on public."type_MACADDR8"
   ->  Foreign Delete on public."type_MACADDR8"
         SQLite query: DELETE FROM main."type_MACADDR8" WHERE ((sqlite_fdw_macaddr_int(`m`, 8) = 0x08002f0102030405))
(3 rows)

--Testcase 106:
SELECT * FROM "type_MACADDR8+";
 i  |            m            |    t    | l  |            tx             
----+-------------------------+---------+----+---------------------------
  1 | 08:00:2b:01:02:03:04:05 | text    | 23 | 08:00:2b:01:02:03:04:05
  2 | 08:00:2b:01:02:03:04:05 | text    | 23 | 08-00-2b-01-02-03-04-05
  3 | 08:00:2b:01:02:03:04:05 | text    | 17 | 08002b01:02030405
  4 | 08:00:2b:01:02:03:04:05 | text    | 17 | 08002b01-02030405
  5 | 08:00:2b:01:02:03:04:05 | text    | 19 | 0800.2b01.0203.0405
  6 | 08:00:2b:01:02:03:04:05 | text    | 19 | 0800-2b01-0203-0405
  7 | 08:00:2b:01:02:03:04:05 | text    | 16 | 08002b0102030405
 15 | 08:aa:2f:01:02:03:04:05 | blob    |  8 | \x08/\x01\x02\x03\x04\x05
 16 | 08:aa:2f:01:02:03:04:05 | text    | 23 | 08:aa:2f:01:02:03:04:05
 17 | 08:aa:2f:01:02:03:04:05 | integer | 18 | 624363179719459845
 18 | 08:00:2b:01:02:03:04:05 | integer | 18 | 576508035632137221
 19 | 08:00:2b:01:02:03:04:05 | integer | 18 | 576508035632137221
 20 | 08:00:2b:01:02:03:04:05 | integer | 18 | 576508035632137221
 21 | 08:00:2b:01:02:03:04:05 | integer | 18 | 576508035632137221
 22 | 08:00:2b:01:02:03:04:05 | integer | 18 | 576508035632137221
 23 | 08:00:2b:01:02:03:04:05 | integer | 18 | 576508035632137221
 31 | 08:00:2b:01:02:03:04:05 | blob    |  8 | \x08
 32 | 08:00:2b:01:02:03:04:05 | blob    |  8 | \x08
 33 | 08:00:2b:01:02:03:04:05 | blob    |  8 | \x08
 34 | 08:00:2b:01:02:03:04:05 | blob    |  8 | \x08
 35 | 08:00:2b:01:02:03:04:05 | blob    |  8 | \x08
 36 | 08:00:2b:01:02:03:04:05 | blob    |  8 | \x08
 37 | 08:00:2b:01:02:03:04:05 | blob    |  8 | \x08
 45 | 08:00:2b:01:02:03:04:05 | text    | 23 | 08:00:2b:01:02:03:04:05
 46 | 08:00:2b:01:02:03:04:05 | text    | 23 | 08:00:2b:01:02:03:04:05
 47 | 08:00:2b:01:02:03:04:05 | text    | 23 | 08:00:2b:01:02:03:04:05
 48 | 08:00:2b:01:02:03:04:05 | text    | 23 | 08:00:2b:01:02:03:04:05
 49 | 08:00:2b:01:02:03:04:05 | text    | 23 | 08:00:2b:01:02:03:04:05
 50 | 08:00:2b:01:02:03:04:05 | text    | 23 | 08:00:2b:01:02:03:04:05
 51 | 08:00:2b:01:02:03:04:05 | text    | 23 | 08:00:2b:01:02:03:04:05
(30 rows)

--Testcase 107:
INSERT INTO "type_MACADDR8" ("i", "m") VALUES (59, '08:AA:2F:01:02:04:04:05');
--Testcase 108:
SELECT * FROM "type_MACADDR8+" WHERE "i" = 59;
 i  |            m            |  t   | l  |           tx            
----+-------------------------+------+----+-------------------------
 59 | 08:aa:2f:01:02:04:04:05 | text | 23 | 08:aa:2f:01:02:04:04:05
(1 row)

--Testcase 109:
UPDATE "type_MACADDR8" SET "m" = '08:AA:2F:01:02:05:04:05' WHERE "m" = '08:AA:2F:01:02:04:04:05';
--Testcase 110: -- text
EXPLAIN (VERBOSE, COSTS OFF)
UPDATE "type_MACADDR8" SET "m" = '08:AA:2F:01:02:05:04:05' WHERE "m" = '08:AA:2F:01:02:04:04:05';
                                                                               QUERY PLAN                                                                                
-------------------------------------------------------------------------------------------------------------------------------------------------------------------------
 Update on public."type_MACADDR8"
   ->  Foreign Update on public."type_MACADDR8"
         SQLite query: UPDATE main."type_MACADDR8" SET `m` = sqlite_fdw_macaddr_str(0x08aa2f0102050405, 8) WHERE ((sqlite_fdw_macaddr_int(`m`, 8) = 0x08aa2f0102040405))
(3 rows)

--Testcase 111:
SELECT * FROM "type_MACADDR8+";
 i  |            m            |    t    | l  |            tx             
----+-------------------------+---------+----+---------------------------
  1 | 08:00:2b:01:02:03:04:05 | text    | 23 | 08:00:2b:01:02:03:04:05
  2 | 08:00:2b:01:02:03:04:05 | text    | 23 | 08-00-2b-01-02-03-04-05
  3 | 08:00:2b:01:02:03:04:05 | text    | 17 | 08002b01:02030405
  4 | 08:00:2b:01:02:03:04:05 | text    | 17 | 08002b01-02030405
  5 | 08:00:2b:01:02:03:04:05 | text    | 19 | 0800.2b01.0203.0405
  6 | 08:00:2b:01:02:03:04:05 | text    | 19 | 0800-2b01-0203-0405
  7 | 08:00:2b:01:02:03:04:05 | text    | 16 | 08002b0102030405
 15 | 08:aa:2f:01:02:03:04:05 | blob    |  8 | \x08/\x01\x02\x03\x04\x05
 16 | 08:aa:2f:01:02:03:04:05 | text    | 23 | 08:aa:2f:01:02:03:04:05
 17 | 08:aa:2f:01:02:03:04:05 | integer | 18 | 624363179719459845
 18 | 08:00:2b:01:02:03:04:05 | integer | 18 | 576508035632137221
 19 | 08:00:2b:01:02:03:04:05 | integer | 18 | 576508035632137221
 20 | 08:00:2b:01:02:03:04:05 | integer | 18 | 576508035632137221
 21 | 08:00:2b:01:02:03:04:05 | integer | 18 | 576508035632137221
 22 | 08:00:2b:01:02:03:04:05 | integer | 18 | 576508035632137221
 23 | 08:00:2b:01:02:03:04:05 | integer | 18 | 576508035632137221
 31 | 08:00:2b:01:02:03:04:05 | blob    |  8 | \x08
 32 | 08:00:2b:01:02:03:04:05 | blob    |  8 | \x08
 33 | 08:00:2b:01:02:03:04:05 | blob    |  8 | \x08
 34 | 08:00:2b:01:02:03:04:05 | blob    |  8 | \x08
 35 | 08:00:2b:01:02:03:04:05 | blob    |  8 | \x08
 36 | 08:00:2b:01:02:03:04:05 | blob    |  8 | \x08
 37 | 08:00:2b:01:02:03:04:05 | blob    |  8 | \x08
 45 | 08:00:2b:01:02:03:04:05 | text    | 23 | 08:00:2b:01:02:03:04:05
 46 | 08:00:2b:01:02:03:04:05 | text    | 23 | 08:00:2b:01:02:03:04:05
 47 | 08:00:2b:01:02:03:04:05 | text    | 23 | 08:00:2b:01:02:03:04:05
 48 | 08:00:2b:01:02:03:04:05 | text    | 23 | 08:00:2b:01:02:03:04:05
 49 | 08:00:2b:01:02:03:04:05 | text    | 23 | 08:00:2b:01:02:03:04:05
 50 | 08:00:2b:01:02:03:04:05 | text    | 23 | 08:00:2b:01:02:03:04:05
 51 | 08:00:2b:01:02:03:04:05 | text    | 23 | 08:00:2b:01:02:03:04:05
 59 | 08:aa:2f:01:02:05:04:05 | text    | 23 | 08:aa:2f:01:02:05:04:05
(31 rows)

--Testcase 112:
ALTER FOREIGN TABLE "type_MACADDR8" ALTER COLUMN "m" OPTIONS (SET column_type 'BLOB');
--Testcase 113:
UPDATE "type_MACADDR8" SET "m" = '08:AA:2F:01:02:03:04:05' WHERE "m" = '08:AA:2F:01:02:05:04:05';
--Testcase 114: -- BLOB
EXPLAIN (VERBOSE, COSTS OFF)
UPDATE "type_MACADDR8" SET "m" = '08:AA:2F:01:02:03:04:05' WHERE "m" = '08:AA:2F:01:02:05:04:05';
                                                                                QUERY PLAN                                                                                
--------------------------------------------------------------------------------------------------------------------------------------------------------------------------
 Update on public."type_MACADDR8"
   ->  Foreign Update on public."type_MACADDR8"
         SQLite query: UPDATE main."type_MACADDR8" SET `m` = sqlite_fdw_macaddr_blob(0x08aa2f0102030405, 8) WHERE ((sqlite_fdw_macaddr_int(`m`, 8) = 0x08aa2f0102050405))
(3 rows)

--Testcase 115:
SELECT * FROM "type_MACADDR8+";
 i  |            m            |    t    | l  |            tx             
----+-------------------------+---------+----+---------------------------
  1 | 08:00:2b:01:02:03:04:05 | text    | 23 | 08:00:2b:01:02:03:04:05
  2 | 08:00:2b:01:02:03:04:05 | text    | 23 | 08-00-2b-01-02-03-04-05
  3 | 08:00:2b:01:02:03:04:05 | text    | 17 | 08002b01:02030405
  4 | 08:00:2b:01:02:03:04:05 | text    | 17 | 08002b01-02030405
  5 | 08:00:2b:01:02:03:04:05 | text    | 19 | 0800.2b01.0203.0405
  6 | 08:00:2b:01:02:03:04:05 | text    | 19 | 0800-2b01-0203-0405
  7 | 08:00:2b:01:02:03:04:05 | text    | 16 | 08002b0102030405
 15 | 08:aa:2f:01:02:03:04:05 | blob    |  8 | \x08/\x01\x02\x03\x04\x05
 16 | 08:aa:2f:01:02:03:04:05 | text    | 23 | 08:aa:2f:01:02:03:04:05
 17 | 08:aa:2f:01:02:03:04:05 | integer | 18 | 624363179719459845
 18 | 08:00:2b:01:02:03:04:05 | integer | 18 | 576508035632137221
 19 | 08:00:2b:01:02:03:04:05 | integer | 18 | 576508035632137221
 20 | 08:00:2b:01:02:03:04:05 | integer | 18 | 576508035632137221
 21 | 08:00:2b:01:02:03:04:05 | integer | 18 | 576508035632137221
 22 | 08:00:2b:01:02:03:04:05 | integer | 18 | 576508035632137221
 23 | 08:00:2b:01:02:03:04:05 | integer | 18 | 576508035632137221
 31 | 08:00:2b:01:02:03:04:05 | blob    |  8 | \x08
 32 | 08:00:2b:01:02:03:04:05 | blob    |  8 | \x08
 33 | 08:00:2b:01:02:03:04:05 | blob    |  8 | \x08
 34 | 08:00:2b:01:02:03:04:05 | blob    |  8 | \x08
 35 | 08:00:2b:01:02:03:04:05 | blob    |  8 | \x08
 36 | 08:00:2b:01:02:03:04:05 | blob    |  8 | \x08
 37 | 08:00:2b:01:02:03:04:05 | blob    |  8 | \x08
 45 | 08:00:2b:01:02:03:04:05 | text    | 23 | 08:00:2b:01:02:03:04:05
 46 | 08:00:2b:01:02:03:04:05 | text    | 23 | 08:00:2b:01:02:03:04:05
 47 | 08:00:2b:01:02:03:04:05 | text    | 23 | 08:00:2b:01:02:03:04:05
 48 | 08:00:2b:01:02:03:04:05 | text    | 23 | 08:00:2b:01:02:03:04:05
 49 | 08:00:2b:01:02:03:04:05 | text    | 23 | 08:00:2b:01:02:03:04:05
 50 | 08:00:2b:01:02:03:04:05 | text    | 23 | 08:00:2b:01:02:03:04:05
 51 | 08:00:2b:01:02:03:04:05 | text    | 23 | 08:00:2b:01:02:03:04:05
 59 | 08:aa:2f:01:02:03:04:05 | blob    |  8 | \x08/\x01\x02\x03\x04\x05
(31 rows)

--Testcase 116:
ALTER FOREIGN TABLE "type_MACADDR8" ALTER COLUMN "m" OPTIONS (SET column_type 'int');
--Testcase 117:
UPDATE "type_MACADDR8" SET "m" = '08:AA:2F:01:02:02:04:05' WHERE "m" = '08:AA:2F:01:02:03:04:05';
--Testcase 118: -- BLOB
EXPLAIN (VERBOSE, COSTS OFF)
UPDATE "type_MACADDR8" SET "m" = '08:AA:2F:01:02:02:04:05' WHERE "m" = '08:AA:2F:01:02:03:04:05';
                                                                  QUERY PLAN                                                                  
----------------------------------------------------------------------------------------------------------------------------------------------
 Update on public."type_MACADDR8"
   ->  Foreign Update on public."type_MACADDR8"
         SQLite query: UPDATE main."type_MACADDR8" SET `m` = 0x08aa2f0102020405 WHERE ((sqlite_fdw_macaddr_int(`m`, 8) = 0x08aa2f0102030405))
(3 rows)

--Testcase 119:
SELECT * FROM "type_MACADDR8+";
 i  |            m            |    t    | l  |           tx            
----+-------------------------+---------+----+-------------------------
  1 | 08:00:2b:01:02:03:04:05 | text    | 23 | 08:00:2b:01:02:03:04:05
  2 | 08:00:2b:01:02:03:04:05 | text    | 23 | 08-00-2b-01-02-03-04-05
  3 | 08:00:2b:01:02:03:04:05 | text    | 17 | 08002b01:02030405
  4 | 08:00:2b:01:02:03:04:05 | text    | 17 | 08002b01-02030405
  5 | 08:00:2b:01:02:03:04:05 | text    | 19 | 0800.2b01.0203.0405
  6 | 08:00:2b:01:02:03:04:05 | text    | 19 | 0800-2b01-0203-0405
  7 | 08:00:2b:01:02:03:04:05 | text    | 16 | 08002b0102030405
 15 | 08:aa:2f:01:02:02:04:05 | integer | 18 | 624363179719394309
 16 | 08:aa:2f:01:02:02:04:05 | integer | 18 | 624363179719394309
 17 | 08:aa:2f:01:02:02:04:05 | integer | 18 | 624363179719394309
 18 | 08:00:2b:01:02:03:04:05 | integer | 18 | 576508035632137221
 19 | 08:00:2b:01:02:03:04:05 | integer | 18 | 576508035632137221
 20 | 08:00:2b:01:02:03:04:05 | integer | 18 | 576508035632137221
 21 | 08:00:2b:01:02:03:04:05 | integer | 18 | 576508035632137221
 22 | 08:00:2b:01:02:03:04:05 | integer | 18 | 576508035632137221
 23 | 08:00:2b:01:02:03:04:05 | integer | 18 | 576508035632137221
 31 | 08:00:2b:01:02:03:04:05 | blob    |  8 | \x08
 32 | 08:00:2b:01:02:03:04:05 | blob    |  8 | \x08
 33 | 08:00:2b:01:02:03:04:05 | blob    |  8 | \x08
 34 | 08:00:2b:01:02:03:04:05 | blob    |  8 | \x08
 35 | 08:00:2b:01:02:03:04:05 | blob    |  8 | \x08
 36 | 08:00:2b:01:02:03:04:05 | blob    |  8 | \x08
 37 | 08:00:2b:01:02:03:04:05 | blob    |  8 | \x08
 45 | 08:00:2b:01:02:03:04:05 | text    | 23 | 08:00:2b:01:02:03:04:05
 46 | 08:00:2b:01:02:03:04:05 | text    | 23 | 08:00:2b:01:02:03:04:05
 47 | 08:00:2b:01:02:03:04:05 | text    | 23 | 08:00:2b:01:02:03:04:05
 48 | 08:00:2b:01:02:03:04:05 | text    | 23 | 08:00:2b:01:02:03:04:05
 49 | 08:00:2b:01:02:03:04:05 | text    | 23 | 08:00:2b:01:02:03:04:05
 50 | 08:00:2b:01:02:03:04:05 | text    | 23 | 08:00:2b:01:02:03:04:05
 51 | 08:00:2b:01:02:03:04:05 | text    | 23 | 08:00:2b:01:02:03:04:05
 59 | 08:aa:2f:01:02:02:04:05 | integer | 18 | 624363179719394309
(31 rows)

--Testcase 120:
DELETE FROM "type_MACADDR8";
--Testcase 121: -- sort test
ALTER FOREIGN TABLE "type_MACADDR8" ALTER COLUMN "m" OPTIONS (SET column_type 'TEXT');
--Testcase 122:
INSERT INTO "type_MACADDR8" ("i", "m") VALUES (60, '01:00:00:00:00:00:00:00');
--Testcase 123:
ALTER FOREIGN TABLE "type_MACADDR8" ALTER COLUMN "m" OPTIONS (SET column_type 'BLOB');
--Testcase 124:
INSERT INTO "type_MACADDR8" ("i", "m") VALUES (61, '02:00:00:00:00:00:00:00');
--Testcase 125:
ALTER FOREIGN TABLE "type_MACADDR8" ALTER COLUMN "m" OPTIONS (SET column_type 'int');
--Testcase 126:
INSERT INTO "type_MACADDR8" ("i", "m") VALUES (62, '03:00:00:00:00:00:00:00');
--Testcase 127:
ALTER FOREIGN TABLE "type_MACADDR8" ALTER COLUMN "m" OPTIONS (SET column_type 'TEXT');
--Testcase 128:
INSERT INTO "type_MACADDR8" ("i", "m") VALUES (63, '00:00:00:00:00:00:00:01');
--Testcase 129:
ALTER FOREIGN TABLE "type_MACADDR8" ALTER COLUMN "m" OPTIONS (SET column_type 'BLOB');
--Testcase 130:
INSERT INTO "type_MACADDR8" ("i", "m") VALUES (64, '00:00:00:00:00:00:00:02');
--Testcase 131:
ALTER FOREIGN TABLE "type_MACADDR8" ALTER COLUMN "m" OPTIONS (SET column_type 'int');
--Testcase 132:
INSERT INTO "type_MACADDR8" ("i", "m") VALUES (65, '00:00:00:00:00:00:00:03');
--Testcase 133:
ALTER FOREIGN TABLE "type_MACADDR8" ALTER COLUMN "m" OPTIONS (SET column_type 'TEXT');
--Testcase 134:
INSERT INTO "type_MACADDR8" ("i", "m") VALUES (66, '00:00:00:00:01:00:00:00');
--Testcase 135:
ALTER FOREIGN TABLE "type_MACADDR8" ALTER COLUMN "m" OPTIONS (SET column_type 'BLOB');
--Testcase 136:
INSERT INTO "type_MACADDR8" ("i", "m") VALUES (67, '00:00:00:00:02:00:00:00');
--Testcase 137:
ALTER FOREIGN TABLE "type_MACADDR8" ALTER COLUMN "m" OPTIONS (SET column_type 'int');
--Testcase 138:
INSERT INTO "type_MACADDR8" ("i", "m") VALUES (68, '00:00:00:00:03:00:00:00');
--Testcase 139:
SELECT * FROM "type_MACADDR8" ORDER BY "m" ASC;
 i  |            m            
----+-------------------------
 63 | 00:00:00:00:00:00:00:01
 64 | 00:00:00:00:00:00:00:02
 65 | 00:00:00:00:00:00:00:03
 66 | 00:00:00:00:01:00:00:00
 67 | 00:00:00:00:02:00:00:00
 68 | 00:00:00:00:03:00:00:00
 60 | 01:00:00:00:00:00:00:00
 61 | 02:00:00:00:00:00:00:00
 62 | 03:00:00:00:00:00:00:00
(9 rows)

--Testcase 140:
SELECT * FROM "type_MACADDR8" ORDER BY "m" DESC;
 i  |            m            
----+-------------------------
 62 | 03:00:00:00:00:00:00:00
 61 | 02:00:00:00:00:00:00:00
 60 | 01:00:00:00:00:00:00:00
 68 | 00:00:00:00:03:00:00:00
 67 | 00:00:00:00:02:00:00:00
 66 | 00:00:00:00:01:00:00:00
 65 | 00:00:00:00:00:00:00:03
 64 | 00:00:00:00:00:00:00:02
 63 | 00:00:00:00:00:00:00:01
(9 rows)

--Testcase 150:
CREATE FOREIGN TABLE "type_MACADDR8pk" (col macaddr8 OPTIONS (key 'true')) SERVER sqlite_svr;
--Testcase 151:
ALTER FOREIGN TABLE "type_MACADDR8pk" ALTER COLUMN col OPTIONS (ADD column_type 'BLOB');
--Testcase 152:
INSERT INTO "type_MACADDR8pk" VALUES ('01:02:03:04:05:06:07:08');
--Testcase 153:
ALTER FOREIGN TABLE "type_MACADDR8pk" ALTER COLUMN col OPTIONS (SET column_type 'int');
--Testcase 154: NO ERR, but the same semantics!
INSERT INTO "type_MACADDR8pk" VALUES ('01:02:03:04:05:06:07:08');
--Testcase 155:
ALTER FOREIGN TABLE "type_MACADDR8pk" ALTER COLUMN col OPTIONS (SET column_type 'text');
--Testcase 156: NO ERR, but the same semantics!
INSERT INTO "type_MACADDR8pk" VALUES ('01:02:03:04:05:06:07:08');
--Testcase 157:
ALTER FOREIGN TABLE "type_MACADDR8pk" ALTER COLUMN col OPTIONS (ADD column_type 'BLOB');
ERROR:  option "column_type" provided more than once
--Testcase 158: ERR - primary key
INSERT INTO "type_MACADDR8pk" VALUES ('01-02-03-04-05-06-07-08');
ERROR:  Failed to execute remote SQL
HINT:  SQLite error 'UNIQUE constraint failed: type_MACADDR8pk.col', SQLite primary result code 19, extended result code 1555
CONTEXT:  SQL query: INSERT INTO main."type_MACADDR8pk"(`col`) VALUES (?)
--Testcase 159:
SELECT * FROM "type_MACADDR8pk";
           col           
-------------------------
 01:02:03:04:05:06:07:08
 01:02:03:04:05:06:07:08
 01:02:03:04:05:06:07:08
(3 rows)

--Testcase 160:
DELETE FROM "type_MACADDR8pk";
--no macaddr8 operators pushing down
--Testcase 161:
EXPLAIN (VERBOSE, COSTS OFF)
SELECT "m" | '01:02:03:04:05:06:07:08' FROM "type_MACADDR8";
                                   QUERY PLAN                                    
---------------------------------------------------------------------------------
 Foreign Scan on public."type_MACADDR8"
   Output: (m | '01:02:03:04:05:06:07:08'::macaddr8)
   SQLite query: SELECT sqlite_fdw_macaddr_int(`m`, 8) FROM main."type_MACADDR8"
(3 rows)

--Testcase 162:
EXPLAIN (VERBOSE, COSTS OFF)
SELECT "m" & '01:02:03:04:05:06:07:08' FROM "type_MACADDR8";
                                   QUERY PLAN                                    
---------------------------------------------------------------------------------
 Foreign Scan on public."type_MACADDR8"
   Output: (m & '01:02:03:04:05:06:07:08'::macaddr8)
   SQLite query: SELECT sqlite_fdw_macaddr_int(`m`, 8) FROM main."type_MACADDR8"
(3 rows)

--Testcase 163:
EXPLAIN (VERBOSE, COSTS OFF)
SELECT ~"m" FROM "type_MACADDR8";
                                   QUERY PLAN                                    
---------------------------------------------------------------------------------
 Foreign Scan on public."type_MACADDR8"
   Output: (~ m)
   SQLite query: SELECT sqlite_fdw_macaddr_int(`m`, 8) FROM main."type_MACADDR8"
(3 rows)

--Testcase 164:
EXPLAIN (VERBOSE, COSTS OFF)
SELECT "m" > '01:02:03:04:05:06:07:08' FROM "type_MACADDR8";
                                   QUERY PLAN                                    
---------------------------------------------------------------------------------
 Foreign Scan on public."type_MACADDR8"
   Output: (m > '01:02:03:04:05:06:07:08'::macaddr8)
   SQLite query: SELECT sqlite_fdw_macaddr_int(`m`, 8) FROM main."type_MACADDR8"
(3 rows)

--Testcase 165:
EXPLAIN (VERBOSE, COSTS OFF)
SELECT "m" < '01:02:03:04:05:06:07:08' FROM "type_MACADDR8";
                                   QUERY PLAN                                    
---------------------------------------------------------------------------------
 Foreign Scan on public."type_MACADDR8"
   Output: (m < '01:02:03:04:05:06:07:08'::macaddr8)
   SQLite query: SELECT sqlite_fdw_macaddr_int(`m`, 8) FROM main."type_MACADDR8"
(3 rows)

--Testcase 166:
EXPLAIN (VERBOSE, COSTS OFF)
SELECT "m" = '01:02:03:04:05:06:07:08' FROM "type_MACADDR8";
                                   QUERY PLAN                                    
---------------------------------------------------------------------------------
 Foreign Scan on public."type_MACADDR8"
   Output: (m = '01:02:03:04:05:06:07:08'::macaddr8)
   SQLite query: SELECT sqlite_fdw_macaddr_int(`m`, 8) FROM main."type_MACADDR8"
(3 rows)

--Testcase 167:
EXPLAIN (VERBOSE, COSTS OFF)
SELECT "m" >= '01:02:03:04:05:06:07:08' FROM "type_MACADDR8";
                                   QUERY PLAN                                    
---------------------------------------------------------------------------------
 Foreign Scan on public."type_MACADDR8"
   Output: (m >= '01:02:03:04:05:06:07:08'::macaddr8)
   SQLite query: SELECT sqlite_fdw_macaddr_int(`m`, 8) FROM main."type_MACADDR8"
(3 rows)

--Testcase 168:
EXPLAIN (VERBOSE, COSTS OFF)
SELECT "m" <= '01:02:03:04:05:06:07:08' FROM "type_MACADDR8";
                                   QUERY PLAN                                    
---------------------------------------------------------------------------------
 Foreign Scan on public."type_MACADDR8"
   Output: (m <= '01:02:03:04:05:06:07:08'::macaddr8)
   SQLite query: SELECT sqlite_fdw_macaddr_int(`m`, 8) FROM main."type_MACADDR8"
(3 rows)

--Testcase 169:
EXPLAIN (VERBOSE, COSTS OFF)
SELECT "m" != '01:02:03:04:05:06:07:08' FROM "type_MACADDR8";
                                   QUERY PLAN                                    
---------------------------------------------------------------------------------
 Foreign Scan on public."type_MACADDR8"
   Output: (m <> '01:02:03:04:05:06:07:08'::macaddr8)
   SQLite query: SELECT sqlite_fdw_macaddr_int(`m`, 8) FROM main."type_MACADDR8"
(3 rows)

--Testcase 200:
DROP EXTENSION sqlite_fdw CASCADE;
NOTICE:  drop cascades to 5 other objects
DETAIL:  drop cascades to server sqlite_svr
drop cascades to foreign table "type_MACADDR8"
drop cascades to foreign table "type_MACADDR8+"
drop cascades to foreign table "type_MACADDR8pk"
drop cascades to server sqlite2
