--
-- NUMERIC
--
CREATE EXTENSION sqlite_fdw;
CREATE SERVER sqlite_svr FOREIGN DATA WRAPPER sqlite_fdw
OPTIONS (database '/tmp/sqlitefdw_test_core.db');
CREATE FOREIGN TABLE num_data (id int4 OPTIONS (key 'true'), val numeric(210,10)) SERVER sqlite_svr;
CREATE FOREIGN TABLE num_exp_add (id1 int4 OPTIONS (key 'true'), id2 int4 OPTIONS (key 'true'), expected numeric(210,10)) SERVER sqlite_svr;
CREATE FOREIGN TABLE num_exp_sub (id1 int4 OPTIONS (key 'true'), id2 int4 OPTIONS (key 'true'), expected numeric(210,10)) SERVER sqlite_svr;
CREATE FOREIGN TABLE num_exp_div (id1 int4 OPTIONS (key 'true'), id2 int4 OPTIONS (key 'true'), expected numeric(210,10)) SERVER sqlite_svr;
CREATE FOREIGN TABLE num_exp_mul (id1 int4 OPTIONS (key 'true'), id2 int4 OPTIONS (key 'true'), expected numeric(210,10)) SERVER sqlite_svr;
CREATE FOREIGN TABLE num_exp_sqrt (id int4 OPTIONS (key 'true'), expected numeric(210,10)) SERVER sqlite_svr;
CREATE FOREIGN TABLE num_exp_ln (id int4 OPTIONS (key 'true'), expected numeric(210,10)) SERVER sqlite_svr;
CREATE FOREIGN TABLE num_exp_log10 (id int4 OPTIONS (key 'true'), expected numeric(210,10)) SERVER sqlite_svr;
CREATE FOREIGN TABLE num_exp_power_10_ln (id int4 OPTIONS (key 'true'), expected numeric(210,10)) SERVER sqlite_svr;
CREATE FOREIGN TABLE num_result (id1 int4 OPTIONS (key 'true'), id2 int4 OPTIONS (key 'true'), result numeric(210,10)) SERVER sqlite_svr;
-- ******************************
-- * The following EXPECTED results are computed by bc(1)
-- * with a scale of 200
-- ******************************
BEGIN TRANSACTION;
--Testcase 1:
INSERT INTO num_exp_add VALUES (0,0,'0');
--Testcase 2:
INSERT INTO num_exp_sub VALUES (0,0,'0');
--Testcase 3:
INSERT INTO num_exp_mul VALUES (0,0,'0');
--Testcase 4:
INSERT INTO num_exp_div VALUES (0,0,'NaN');
--Testcase 5:
INSERT INTO num_exp_add VALUES (0,1,'0');
--Testcase 6:
INSERT INTO num_exp_sub VALUES (0,1,'0');
--Testcase 7:
INSERT INTO num_exp_mul VALUES (0,1,'0');
--Testcase 8:
INSERT INTO num_exp_div VALUES (0,1,'NaN');
--Testcase 9:
INSERT INTO num_exp_add VALUES (0,2,'-34338492.215397047');
--Testcase 10:
INSERT INTO num_exp_sub VALUES (0,2,'34338492.215397047');
--Testcase 11:
INSERT INTO num_exp_mul VALUES (0,2,'0');
--Testcase 12:
INSERT INTO num_exp_div VALUES (0,2,'0');
--Testcase 13:
INSERT INTO num_exp_add VALUES (0,3,'4.31');
--Testcase 14:
INSERT INTO num_exp_sub VALUES (0,3,'-4.31');
--Testcase 15:
INSERT INTO num_exp_mul VALUES (0,3,'0');
--Testcase 16:
INSERT INTO num_exp_div VALUES (0,3,'0');
--Testcase 17:
INSERT INTO num_exp_add VALUES (0,4,'7799461.4119');
--Testcase 18:
INSERT INTO num_exp_sub VALUES (0,4,'-7799461.4119');
--Testcase 19:
INSERT INTO num_exp_mul VALUES (0,4,'0');
--Testcase 20:
INSERT INTO num_exp_div VALUES (0,4,'0');
--Testcase 21:
INSERT INTO num_exp_add VALUES (0,5,'16397.038491');
--Testcase 22:
INSERT INTO num_exp_sub VALUES (0,5,'-16397.038491');
--Testcase 23:
INSERT INTO num_exp_mul VALUES (0,5,'0');
--Testcase 24:
INSERT INTO num_exp_div VALUES (0,5,'0');
--Testcase 25:
INSERT INTO num_exp_add VALUES (0,6,'93901.57763026');
--Testcase 26:
INSERT INTO num_exp_sub VALUES (0,6,'-93901.57763026');
--Testcase 27:
INSERT INTO num_exp_mul VALUES (0,6,'0');
--Testcase 28:
INSERT INTO num_exp_div VALUES (0,6,'0');
--Testcase 29:
INSERT INTO num_exp_add VALUES (0,7,'-83028485');
--Testcase 30:
INSERT INTO num_exp_sub VALUES (0,7,'83028485');
--Testcase 31:
INSERT INTO num_exp_mul VALUES (0,7,'0');
--Testcase 32:
INSERT INTO num_exp_div VALUES (0,7,'0');
--Testcase 33:
INSERT INTO num_exp_add VALUES (0,8,'74881');
--Testcase 34:
INSERT INTO num_exp_sub VALUES (0,8,'-74881');
--Testcase 35:
INSERT INTO num_exp_mul VALUES (0,8,'0');
--Testcase 36:
INSERT INTO num_exp_div VALUES (0,8,'0');
--Testcase 37:
INSERT INTO num_exp_add VALUES (0,9,'-24926804.045047420');
--Testcase 38:
INSERT INTO num_exp_sub VALUES (0,9,'24926804.045047420');
--Testcase 39:
INSERT INTO num_exp_mul VALUES (0,9,'0');
--Testcase 40:
INSERT INTO num_exp_div VALUES (0,9,'0');
--Testcase 41:
INSERT INTO num_exp_add VALUES (1,0,'0');
--Testcase 42:
INSERT INTO num_exp_sub VALUES (1,0,'0');
--Testcase 43:
INSERT INTO num_exp_mul VALUES (1,0,'0');
--Testcase 44:
INSERT INTO num_exp_div VALUES (1,0,'NaN');
--Testcase 45:
INSERT INTO num_exp_add VALUES (1,1,'0');
--Testcase 46:
INSERT INTO num_exp_sub VALUES (1,1,'0');
--Testcase 47:
INSERT INTO num_exp_mul VALUES (1,1,'0');
--Testcase 48:
INSERT INTO num_exp_div VALUES (1,1,'NaN');
--Testcase 49:
INSERT INTO num_exp_add VALUES (1,2,'-34338492.215397047');
--Testcase 50:
INSERT INTO num_exp_sub VALUES (1,2,'34338492.215397047');
--Testcase 51:
INSERT INTO num_exp_mul VALUES (1,2,'0');
--Testcase 52:
INSERT INTO num_exp_div VALUES (1,2,'0');
--Testcase 53:
INSERT INTO num_exp_add VALUES (1,3,'4.31');
--Testcase 54:
INSERT INTO num_exp_sub VALUES (1,3,'-4.31');
--Testcase 55:
INSERT INTO num_exp_mul VALUES (1,3,'0');
--Testcase 56:
INSERT INTO num_exp_div VALUES (1,3,'0');
--Testcase 57:
INSERT INTO num_exp_add VALUES (1,4,'7799461.4119');
--Testcase 58:
INSERT INTO num_exp_sub VALUES (1,4,'-7799461.4119');
--Testcase 59:
INSERT INTO num_exp_mul VALUES (1,4,'0');
--Testcase 60:
INSERT INTO num_exp_div VALUES (1,4,'0');
--Testcase 61:
INSERT INTO num_exp_add VALUES (1,5,'16397.038491');
--Testcase 62:
INSERT INTO num_exp_sub VALUES (1,5,'-16397.038491');
--Testcase 63:
INSERT INTO num_exp_mul VALUES (1,5,'0');
--Testcase 64:
INSERT INTO num_exp_div VALUES (1,5,'0');
--Testcase 65:
INSERT INTO num_exp_add VALUES (1,6,'93901.57763026');
--Testcase 66:
INSERT INTO num_exp_sub VALUES (1,6,'-93901.57763026');
--Testcase 67:
INSERT INTO num_exp_mul VALUES (1,6,'0');
--Testcase 68:
INSERT INTO num_exp_div VALUES (1,6,'0');
--Testcase 69:
INSERT INTO num_exp_add VALUES (1,7,'-83028485');
--Testcase 70:
INSERT INTO num_exp_sub VALUES (1,7,'83028485');
--Testcase 71:
INSERT INTO num_exp_mul VALUES (1,7,'0');
--Testcase 72:
INSERT INTO num_exp_div VALUES (1,7,'0');
--Testcase 73:
INSERT INTO num_exp_add VALUES (1,8,'74881');
--Testcase 74:
INSERT INTO num_exp_sub VALUES (1,8,'-74881');
--Testcase 75:
INSERT INTO num_exp_mul VALUES (1,8,'0');
--Testcase 76:
INSERT INTO num_exp_div VALUES (1,8,'0');
--Testcase 77:
INSERT INTO num_exp_add VALUES (1,9,'-24926804.045047420');
--Testcase 78:
INSERT INTO num_exp_sub VALUES (1,9,'24926804.045047420');
--Testcase 79:
INSERT INTO num_exp_mul VALUES (1,9,'0');
--Testcase 80:
INSERT INTO num_exp_div VALUES (1,9,'0');
--Testcase 81:
INSERT INTO num_exp_add VALUES (2,0,'-34338492.215397047');
--Testcase 82:
INSERT INTO num_exp_sub VALUES (2,0,'-34338492.215397047');
--Testcase 83:
INSERT INTO num_exp_mul VALUES (2,0,'0');
--Testcase 84:
INSERT INTO num_exp_div VALUES (2,0,'NaN');
--Testcase 85:
INSERT INTO num_exp_add VALUES (2,1,'-34338492.215397047');
--Testcase 86:
INSERT INTO num_exp_sub VALUES (2,1,'-34338492.215397047');
--Testcase 87:
INSERT INTO num_exp_mul VALUES (2,1,'0');
--Testcase 88:
INSERT INTO num_exp_div VALUES (2,1,'NaN');
--Testcase 89:
INSERT INTO num_exp_add VALUES (2,2,'-68676984.430794');
--Testcase 90:
INSERT INTO num_exp_sub VALUES (2,2,'0');
--Testcase 91:
INSERT INTO num_exp_mul VALUES (2,2,'1179132047626883.596862135856320209');
--Testcase 92:
INSERT INTO num_exp_div VALUES (2,2,'1.00000000000000000000');
--Testcase 93:
INSERT INTO num_exp_add VALUES (2,3,'-34338487.905397');
--Testcase 94:
INSERT INTO num_exp_sub VALUES (2,3,'-34338496.525397047');
--Testcase 95:
INSERT INTO num_exp_mul VALUES (2,3,'-147998901.44836127257');
--Testcase 96:
INSERT INTO num_exp_div VALUES (2,3,'-7967167.56737749');
--Testcase 97:
INSERT INTO num_exp_add VALUES (2,4,'-26539030.803497047');
--Testcase 98:
INSERT INTO num_exp_sub VALUES (2,4,'-42137953.627297047');
--Testcase 99:
INSERT INTO num_exp_mul VALUES (2,4,'-267821744976817.0');
--Testcase 100:
INSERT INTO num_exp_div VALUES (2,4,'-4.40267480046830116685');
--Testcase 101:
INSERT INTO num_exp_add VALUES (2,5,'-34322095.176906047');
--Testcase 102:
INSERT INTO num_exp_sub VALUES (2,5,'-34354889.253888047');
--Testcase 103:
INSERT INTO num_exp_mul VALUES (2,5,'-563049578578.768');
--Testcase 104:
INSERT INTO num_exp_div VALUES (2,5,'-2094.18866914563535496429');
--Testcase 105:
INSERT INTO num_exp_add VALUES (2,6,'-34244590.6377667');
--Testcase 106:
INSERT INTO num_exp_sub VALUES (2,6,'-34432393.793027307');
--Testcase 107:
INSERT INTO num_exp_mul VALUES (2,6,'-3224438592470.18449811926184222');
--Testcase 108:
INSERT INTO num_exp_div VALUES (2,6,'-365.68599891479766440940');
--Testcase 109:
INSERT INTO num_exp_add VALUES (2,7,'-117366977.215397047');
--Testcase 110:
INSERT INTO num_exp_sub VALUES (2,7,'48689992.784602953');
--Testcase 111:
INSERT INTO num_exp_mul VALUES (2,7,'2851072985828710.485883795');
--Testcase 112:
INSERT INTO num_exp_div VALUES (2,7,'.41357483778485235518');
--Testcase 113:
INSERT INTO num_exp_add VALUES (2,8,'-34263611.215397047');
--Testcase 114:
INSERT INTO num_exp_sub VALUES (2,8,'-34413373.215397047');
--Testcase 115:
INSERT INTO num_exp_mul VALUES (2,8,'-2571300635581.14');
--Testcase 116:
INSERT INTO num_exp_div VALUES (2,8,'-458.57416721727870888476');
--Testcase 117:
INSERT INTO num_exp_add VALUES (2,9,'-59265296.2604444');
--Testcase 118:
INSERT INTO num_exp_sub VALUES (2,9,'-9411688.1703496');
--Testcase 119:
INSERT INTO num_exp_mul VALUES (2,9,'855948866655587.0');
--Testcase 120:
INSERT INTO num_exp_div VALUES (2,9,'1.37757299946438931811');
--Testcase 121:
INSERT INTO num_exp_add VALUES (3,0,'4.31');
--Testcase 122:
INSERT INTO num_exp_sub VALUES (3,0,'4.31');
--Testcase 123:
INSERT INTO num_exp_mul VALUES (3,0,'0');
--Testcase 124:
INSERT INTO num_exp_div VALUES (3,0,'NaN');
--Testcase 125:
INSERT INTO num_exp_add VALUES (3,1,'4.31');
--Testcase 126:
INSERT INTO num_exp_sub VALUES (3,1,'4.31');
--Testcase 127:
INSERT INTO num_exp_mul VALUES (3,1,'0');
--Testcase 128:
INSERT INTO num_exp_div VALUES (3,1,'NaN');
--Testcase 129:
INSERT INTO num_exp_add VALUES (3,2,'-34338487.905397');
--Testcase 130:
INSERT INTO num_exp_sub VALUES (3,2,'34338496.525397047');
--Testcase 131:
INSERT INTO num_exp_mul VALUES (3,2,'-147998901.44836127257');
--Testcase 132:
INSERT INTO num_exp_div VALUES (3,2,'-.00000012551512084352');
--Testcase 133:
INSERT INTO num_exp_add VALUES (3,3,'8.62');
--Testcase 134:
INSERT INTO num_exp_sub VALUES (3,3,'0');
--Testcase 135:
INSERT INTO num_exp_mul VALUES (3,3,'18.5761');
--Testcase 136:
INSERT INTO num_exp_div VALUES (3,3,'1.00000000000000000000');
--Testcase 137:
INSERT INTO num_exp_add VALUES (3,4,'7799465.7219');
--Testcase 138:
INSERT INTO num_exp_sub VALUES (3,4,'-7799457.1019');
--Testcase 139:
INSERT INTO num_exp_mul VALUES (3,4,'33615678.685289');
--Testcase 140:
INSERT INTO num_exp_div VALUES (3,4,'.00000055260225961552');
--Testcase 141:
INSERT INTO num_exp_add VALUES (3,5,'16401.348491');
--Testcase 142:
INSERT INTO num_exp_sub VALUES (3,5,'-16392.728491');
--Testcase 143:
INSERT INTO num_exp_mul VALUES (3,5,'70671.23589621');
--Testcase 144:
INSERT INTO num_exp_div VALUES (3,5,'.00026285234387695504');
--Testcase 145:
INSERT INTO num_exp_add VALUES (3,6,'93905.88763026');
--Testcase 146:
INSERT INTO num_exp_sub VALUES (3,6,'-93897.26763026');
--Testcase 147:
INSERT INTO num_exp_mul VALUES (3,6,'404715.7995864206');
--Testcase 148:
INSERT INTO num_exp_div VALUES (3,6,'.00004589912234457595');
--Testcase 149:
INSERT INTO num_exp_add VALUES (3,7,'-83028480.69');
--Testcase 150:
INSERT INTO num_exp_sub VALUES (3,7,'83028489.31');
--Testcase 151:
INSERT INTO num_exp_mul VALUES (3,7,'-357852770.35');
--Testcase 152:
INSERT INTO num_exp_div VALUES (3,7,'-.00000005190989574240');
--Testcase 153:
INSERT INTO num_exp_add VALUES (3,8,'74885.31');
--Testcase 154:
INSERT INTO num_exp_sub VALUES (3,8,'-74876.69');
--Testcase 155:
INSERT INTO num_exp_mul VALUES (3,8,'322737.11');
--Testcase 156:
INSERT INTO num_exp_div VALUES (3,8,'.00005755799201399553');
--Testcase 157:
INSERT INTO num_exp_add VALUES (3,9,'-24926799.735047420');
--Testcase 158:
INSERT INTO num_exp_sub VALUES (3,9,'24926808.355047420');
--Testcase 159:
INSERT INTO num_exp_mul VALUES (3,9,'-107434525.43415438020');
--Testcase 160:
INSERT INTO num_exp_div VALUES (3,9,'-.00000017290624149854');
--Testcase 161:
INSERT INTO num_exp_add VALUES (4,0,'7799461.4119');
--Testcase 162:
INSERT INTO num_exp_sub VALUES (4,0,'7799461.4119');
--Testcase 163:
INSERT INTO num_exp_mul VALUES (4,0,'0');
--Testcase 164:
INSERT INTO num_exp_div VALUES (4,0,'NaN');
--Testcase 165:
INSERT INTO num_exp_add VALUES (4,1,'7799461.4119');
--Testcase 166:
INSERT INTO num_exp_sub VALUES (4,1,'7799461.4119');
--Testcase 167:
INSERT INTO num_exp_mul VALUES (4,1,'0');
--Testcase 168:
INSERT INTO num_exp_div VALUES (4,1,'NaN');
--Testcase 169:
INSERT INTO num_exp_add VALUES (4,2,'-26539030.803497047');
--Testcase 170:
INSERT INTO num_exp_sub VALUES (4,2,'42137953.627297047');
--Testcase 171:
INSERT INTO num_exp_mul VALUES (4,2,'-267821744976817.0');
--Testcase 172:
INSERT INTO num_exp_div VALUES (4,2,'-.22713465002993920385');
--Testcase 173:
INSERT INTO num_exp_add VALUES (4,3,'7799465.7219');
--Testcase 174:
INSERT INTO num_exp_sub VALUES (4,3,'7799457.1019');
--Testcase 175:
INSERT INTO num_exp_mul VALUES (4,3,'33615678.685289');
--Testcase 176:
INSERT INTO num_exp_div VALUES (4,3,'1809619.81714617169373549883');
--Testcase 177:
INSERT INTO num_exp_add VALUES (4,4,'15598922.8238');
--Testcase 178:
INSERT INTO num_exp_sub VALUES (4,4,'0');
--Testcase 179:
INSERT INTO num_exp_mul VALUES (4,4,'60831598315717.14146161');
--Testcase 180:
INSERT INTO num_exp_div VALUES (4,4,'1.00000000000000000000');
--Testcase 181:
INSERT INTO num_exp_add VALUES (4,5,'7815858.450391');
--Testcase 182:
INSERT INTO num_exp_sub VALUES (4,5,'7783064.373409');
--Testcase 183:
INSERT INTO num_exp_mul VALUES (4,5,'127888068979.9935054429');
--Testcase 184:
INSERT INTO num_exp_div VALUES (4,5,'475.66281046305802686061');
--Testcase 185:
INSERT INTO num_exp_add VALUES (4,6,'7893362.98953026');
--Testcase 186:
INSERT INTO num_exp_sub VALUES (4,6,'7705559.83426974');
--Testcase 187:
INSERT INTO num_exp_mul VALUES (4,6,'732381731243.745115764094');
--Testcase 188:
INSERT INTO num_exp_div VALUES (4,6,'83.05996138436129499606');
--Testcase 189:
INSERT INTO num_exp_add VALUES (4,7,'-75229023.5881');
--Testcase 190:
INSERT INTO num_exp_sub VALUES (4,7,'90827946.4119');
--Testcase 191:
INSERT INTO num_exp_mul VALUES (4,7,'-647577464846017.9715');
--Testcase 192:
INSERT INTO num_exp_div VALUES (4,7,'-.09393717604145131637');
--Testcase 193:
INSERT INTO num_exp_add VALUES (4,8,'7874342.4119');
--Testcase 194:
INSERT INTO num_exp_sub VALUES (4,8,'7724580.4119');
--Testcase 195:
INSERT INTO num_exp_mul VALUES (4,8,'584031469984.4839');
--Testcase 196:
INSERT INTO num_exp_div VALUES (4,8,'104.15808298366741897143');
--Testcase 197:
INSERT INTO num_exp_add VALUES (4,9,'-17127342.633147420');
--Testcase 198:
INSERT INTO num_exp_sub VALUES (4,9,'32726265.456947420');
--Testcase 199:
INSERT INTO num_exp_mul VALUES (4,9,'-194415646271340.1815956522980');
--Testcase 200:
INSERT INTO num_exp_div VALUES (4,9,'-.31289456112403769409');
--Testcase 201:
INSERT INTO num_exp_add VALUES (5,0,'16397.038491');
--Testcase 202:
INSERT INTO num_exp_sub VALUES (5,0,'16397.038491');
--Testcase 203:
INSERT INTO num_exp_mul VALUES (5,0,'0');
--Testcase 204:
INSERT INTO num_exp_div VALUES (5,0,'NaN');
--Testcase 205:
INSERT INTO num_exp_add VALUES (5,1,'16397.038491');
--Testcase 206:
INSERT INTO num_exp_sub VALUES (5,1,'16397.038491');
--Testcase 207:
INSERT INTO num_exp_mul VALUES (5,1,'0');
--Testcase 208:
INSERT INTO num_exp_div VALUES (5,1,'NaN');
--Testcase 209:
INSERT INTO num_exp_add VALUES (5,2,'-34322095.176906047');
--Testcase 210:
INSERT INTO num_exp_sub VALUES (5,2,'34354889.253888047');
--Testcase 211:
INSERT INTO num_exp_mul VALUES (5,2,'-563049578578.768');
--Testcase 212:
INSERT INTO num_exp_div VALUES (5,2,'-.00047751189505192446');
--Testcase 213:
INSERT INTO num_exp_add VALUES (5,3,'16401.348491');
--Testcase 214:
INSERT INTO num_exp_sub VALUES (5,3,'16392.728491');
--Testcase 215:
INSERT INTO num_exp_mul VALUES (5,3,'70671.23589621');
--Testcase 216:
INSERT INTO num_exp_div VALUES (5,3,'3804.41728329466357308584');
--Testcase 217:
INSERT INTO num_exp_add VALUES (5,4,'7815858.450391');
--Testcase 218:
INSERT INTO num_exp_sub VALUES (5,4,'-7783064.373409');
--Testcase 219:
INSERT INTO num_exp_mul VALUES (5,4,'127888068979.9935054429');
--Testcase 220:
INSERT INTO num_exp_div VALUES (5,4,'.00210232958726897192');
--Testcase 221:
INSERT INTO num_exp_add VALUES (5,5,'32794.076982');
--Testcase 222:
INSERT INTO num_exp_sub VALUES (5,5,'0');
--Testcase 223:
INSERT INTO num_exp_mul VALUES (5,5,'268862871.275335557081');
--Testcase 224:
INSERT INTO num_exp_div VALUES (5,5,'1.00000000000000000000');
--Testcase 225:
INSERT INTO num_exp_add VALUES (5,6,'110298.61612126');
--Testcase 226:
INSERT INTO num_exp_sub VALUES (5,6,'-77504.53913926');
--Testcase 227:
INSERT INTO num_exp_mul VALUES (5,6,'1539707782.76899778633766');
--Testcase 228:
INSERT INTO num_exp_div VALUES (5,6,'.17461941433576102689');
--Testcase 229:
INSERT INTO num_exp_add VALUES (5,7,'-83012087.961509');
--Testcase 230:
INSERT INTO num_exp_sub VALUES (5,7,'83044882.038491');
--Testcase 231:
INSERT INTO num_exp_mul VALUES (5,7,'-1361421264394.416135');
--Testcase 232:
INSERT INTO num_exp_div VALUES (5,7,'-.00019748690453643710');
--Testcase 233:
INSERT INTO num_exp_add VALUES (5,8,'91278.038491');
--Testcase 234:
INSERT INTO num_exp_sub VALUES (5,8,'-58483.961509');
--Testcase 235:
INSERT INTO num_exp_mul VALUES (5,8,'1227826639.244571');
--Testcase 236:
INSERT INTO num_exp_div VALUES (5,8,'.21897461960978085228');
--Testcase 237:
INSERT INTO num_exp_add VALUES (5,9,'-24910407.006556420');
--Testcase 238:
INSERT INTO num_exp_sub VALUES (5,9,'24943201.083538420');
--Testcase 239:
INSERT INTO num_exp_mul VALUES (5,9,'-408725765384.257043660243220');
--Testcase 240:
INSERT INTO num_exp_div VALUES (5,9,'-.00065780749354660427');
--Testcase 241:
INSERT INTO num_exp_add VALUES (6,0,'93901.57763026');
--Testcase 242:
INSERT INTO num_exp_sub VALUES (6,0,'93901.57763026');
--Testcase 243:
INSERT INTO num_exp_mul VALUES (6,0,'0');
--Testcase 244:
INSERT INTO num_exp_div VALUES (6,0,'NaN');
--Testcase 245:
INSERT INTO num_exp_add VALUES (6,1,'93901.57763026');
--Testcase 246:
INSERT INTO num_exp_sub VALUES (6,1,'93901.57763026');
--Testcase 247:
INSERT INTO num_exp_mul VALUES (6,1,'0');
--Testcase 248:
INSERT INTO num_exp_div VALUES (6,1,'NaN');
--Testcase 249:
INSERT INTO num_exp_add VALUES (6,2,'-34244590.6377667');
--Testcase 250:
INSERT INTO num_exp_sub VALUES (6,2,'34432393.793027307');
--Testcase 251:
INSERT INTO num_exp_mul VALUES (6,2,'-3224438592470.18449811926184222');
--Testcase 252:
INSERT INTO num_exp_div VALUES (6,2,'-.00273458651128995823');
--Testcase 253:
INSERT INTO num_exp_add VALUES (6,3,'93905.88763026');
--Testcase 254:
INSERT INTO num_exp_sub VALUES (6,3,'93897.26763026');
--Testcase 255:
INSERT INTO num_exp_mul VALUES (6,3,'404715.7995864206');
--Testcase 256:
INSERT INTO num_exp_div VALUES (6,3,'21786.90896293735498839907');
--Testcase 257:
INSERT INTO num_exp_add VALUES (6,4,'7893362.98953026');
--Testcase 258:
INSERT INTO num_exp_sub VALUES (6,4,'-7705559.83426974');
--Testcase 259:
INSERT INTO num_exp_mul VALUES (6,4,'732381731243.745115764094');
--Testcase 260:
INSERT INTO num_exp_div VALUES (6,4,'.01203949512295682469');
--Testcase 261:
INSERT INTO num_exp_add VALUES (6,5,'110298.61612126');
--Testcase 262:
INSERT INTO num_exp_sub VALUES (6,5,'77504.53913926');
--Testcase 263:
INSERT INTO num_exp_mul VALUES (6,5,'1539707782.76899778633766');
--Testcase 264:
INSERT INTO num_exp_div VALUES (6,5,'5.72674008674192359679');
--Testcase 265:
INSERT INTO num_exp_add VALUES (6,6,'187803.15526052');
--Testcase 266:
INSERT INTO num_exp_sub VALUES (6,6,'0');
--Testcase 267:
INSERT INTO num_exp_mul VALUES (6,6,'8817506281.4517452372676676');
--Testcase 268:
INSERT INTO num_exp_div VALUES (6,6,'1.00000000000000000000');
--Testcase 269:
INSERT INTO num_exp_add VALUES (6,7,'-82934583.42236974');
--Testcase 270:
INSERT INTO num_exp_sub VALUES (6,7,'83122386.57763026');
--Testcase 271:
INSERT INTO num_exp_mul VALUES (6,7,'-7796505729750.37795610');
--Testcase 272:
INSERT INTO num_exp_div VALUES (6,7,'-.00113095617281538980');
--Testcase 273:
INSERT INTO num_exp_add VALUES (6,8,'168782.57763026');
--Testcase 274:
INSERT INTO num_exp_sub VALUES (6,8,'19020.57763026');
--Testcase 275:
INSERT INTO num_exp_mul VALUES (6,8,'7031444034.53149906');
--Testcase 276:
INSERT INTO num_exp_div VALUES (6,8,'1.25401073209839612184');
--Testcase 277:
INSERT INTO num_exp_add VALUES (6,9,'-24832902.4674171');
--Testcase 278:
INSERT INTO num_exp_sub VALUES (6,9,'25020705.622677680');
--Testcase 279:
INSERT INTO num_exp_mul VALUES (6,9,'-2340666225110.29929521292692920');
--Testcase 280:
INSERT INTO num_exp_div VALUES (6,9,'-.00376709254265256789');
--Testcase 281:
INSERT INTO num_exp_add VALUES (7,0,'-83028485');
--Testcase 282:
INSERT INTO num_exp_sub VALUES (7,0,'-83028485');
--Testcase 283:
INSERT INTO num_exp_mul VALUES (7,0,'0');
--Testcase 284:
INSERT INTO num_exp_div VALUES (7,0,'NaN');
--Testcase 285:
INSERT INTO num_exp_add VALUES (7,1,'-83028485');
--Testcase 286:
INSERT INTO num_exp_sub VALUES (7,1,'-83028485');
--Testcase 287:
INSERT INTO num_exp_mul VALUES (7,1,'0');
--Testcase 288:
INSERT INTO num_exp_div VALUES (7,1,'NaN');
--Testcase 289:
INSERT INTO num_exp_add VALUES (7,2,'-117366977.215397047');
--Testcase 290:
INSERT INTO num_exp_sub VALUES (7,2,'-48689992.784602953');
--Testcase 291:
INSERT INTO num_exp_mul VALUES (7,2,'2851072985828710.485883795');
--Testcase 292:
INSERT INTO num_exp_div VALUES (7,2,'2.41794207151503385700');
--Testcase 293:
INSERT INTO num_exp_add VALUES (7,3,'-83028480.69');
--Testcase 294:
INSERT INTO num_exp_sub VALUES (7,3,'-83028489.31');
--Testcase 295:
INSERT INTO num_exp_mul VALUES (7,3,'-357852770.35');
--Testcase 296:
INSERT INTO num_exp_div VALUES (7,3,'-19264149.65197215777262180974');
--Testcase 297:
INSERT INTO num_exp_add VALUES (7,4,'-75229023.5881');
--Testcase 298:
INSERT INTO num_exp_sub VALUES (7,4,'-90827946.4119');
--Testcase 299:
INSERT INTO num_exp_mul VALUES (7,4,'-647577464846017.9715');
--Testcase 300:
INSERT INTO num_exp_div VALUES (7,4,'-10.64541262725136247686');
--Testcase 301:
INSERT INTO num_exp_add VALUES (7,5,'-83012087.961509');
--Testcase 302:
INSERT INTO num_exp_sub VALUES (7,5,'-83044882.038491');
--Testcase 303:
INSERT INTO num_exp_mul VALUES (7,5,'-1361421264394.416135');
--Testcase 304:
INSERT INTO num_exp_div VALUES (7,5,'-5063.62688881730941836574');
--Testcase 305:
INSERT INTO num_exp_add VALUES (7,6,'-82934583.42236974');
--Testcase 306:
INSERT INTO num_exp_sub VALUES (7,6,'-83122386.57763026');
--Testcase 307:
INSERT INTO num_exp_mul VALUES (7,6,'-7796505729750.37795610');
--Testcase 308:
INSERT INTO num_exp_div VALUES (7,6,'-884.20756174009028770294');
--Testcase 309:
INSERT INTO num_exp_add VALUES (7,7,'-166056970');
--Testcase 310:
INSERT INTO num_exp_sub VALUES (7,7,'0');
--Testcase 311:
INSERT INTO num_exp_mul VALUES (7,7,'6893729321395225');
--Testcase 312:
INSERT INTO num_exp_div VALUES (7,7,'1.00000000000000000000');
--Testcase 313:
INSERT INTO num_exp_add VALUES (7,8,'-82953604');
--Testcase 314:
INSERT INTO num_exp_sub VALUES (7,8,'-83103366');
--Testcase 315:
INSERT INTO num_exp_mul VALUES (7,8,'-6217255985285');
--Testcase 316:
INSERT INTO num_exp_div VALUES (7,8,'-1108.80577182462841041118');
--Testcase 317:
INSERT INTO num_exp_add VALUES (7,9,'-107955289.045047420');
--Testcase 318:
INSERT INTO num_exp_sub VALUES (7,9,'-58101680.954952580');
--Testcase 319:
INSERT INTO num_exp_mul VALUES (7,9,'2069634775752160');
--Testcase 320:
INSERT INTO num_exp_div VALUES (7,9,'3.33089171198810413382');
--Testcase 321:
INSERT INTO num_exp_add VALUES (8,0,'74881');
--Testcase 322:
INSERT INTO num_exp_sub VALUES (8,0,'74881');
--Testcase 323:
INSERT INTO num_exp_mul VALUES (8,0,'0');
--Testcase 324:
INSERT INTO num_exp_div VALUES (8,0,'NaN');
--Testcase 325:
INSERT INTO num_exp_add VALUES (8,1,'74881');
--Testcase 326:
INSERT INTO num_exp_sub VALUES (8,1,'74881');
--Testcase 327:
INSERT INTO num_exp_mul VALUES (8,1,'0');
--Testcase 328:
INSERT INTO num_exp_div VALUES (8,1,'NaN');
--Testcase 329:
INSERT INTO num_exp_add VALUES (8,2,'-34263611.215397047');
--Testcase 330:
INSERT INTO num_exp_sub VALUES (8,2,'34413373.215397047');
--Testcase 331:
INSERT INTO num_exp_mul VALUES (8,2,'-2571300635581.14');
--Testcase 332:
INSERT INTO num_exp_div VALUES (8,2,'-.00218067233500788615');
--Testcase 333:
INSERT INTO num_exp_add VALUES (8,3,'74885.31');
--Testcase 334:
INSERT INTO num_exp_sub VALUES (8,3,'74876.69');
--Testcase 335:
INSERT INTO num_exp_mul VALUES (8,3,'322737.11');
--Testcase 336:
INSERT INTO num_exp_div VALUES (8,3,'17373.78190255220417633410');
--Testcase 337:
INSERT INTO num_exp_add VALUES (8,4,'7874342.4119');
--Testcase 338:
INSERT INTO num_exp_sub VALUES (8,4,'-7724580.4119');
--Testcase 339:
INSERT INTO num_exp_mul VALUES (8,4,'584031469984.4839');
--Testcase 340:
INSERT INTO num_exp_div VALUES (8,4,'.00960079113741758956');
--Testcase 341:
INSERT INTO num_exp_add VALUES (8,5,'91278.038491');
--Testcase 342:
INSERT INTO num_exp_sub VALUES (8,5,'58483.961509');
--Testcase 343:
INSERT INTO num_exp_mul VALUES (8,5,'1227826639.244571');
--Testcase 344:
INSERT INTO num_exp_div VALUES (8,5,'4.56673929509287019456');
--Testcase 345:
INSERT INTO num_exp_add VALUES (8,6,'168782.57763026');
--Testcase 346:
INSERT INTO num_exp_sub VALUES (8,6,'-19020.57763026');
--Testcase 347:
INSERT INTO num_exp_mul VALUES (8,6,'7031444034.53149906');
--Testcase 348:
INSERT INTO num_exp_div VALUES (8,6,'.79744134113322314424');
--Testcase 349:
INSERT INTO num_exp_add VALUES (8,7,'-82953604');
--Testcase 350:
INSERT INTO num_exp_sub VALUES (8,7,'83103366');
--Testcase 351:
INSERT INTO num_exp_mul VALUES (8,7,'-6217255985285');
--Testcase 352:
INSERT INTO num_exp_div VALUES (8,7,'-.00090187120721280172');
--Testcase 353:
INSERT INTO num_exp_add VALUES (8,8,'149762');
--Testcase 354:
INSERT INTO num_exp_sub VALUES (8,8,'0');
--Testcase 355:
INSERT INTO num_exp_mul VALUES (8,8,'5607164161');
--Testcase 356:
INSERT INTO num_exp_div VALUES (8,8,'1.00000000000000000000');
--Testcase 357:
INSERT INTO num_exp_add VALUES (8,9,'-24851923.045047420');
--Testcase 358:
INSERT INTO num_exp_sub VALUES (8,9,'25001685.045047420');
--Testcase 359:
INSERT INTO num_exp_mul VALUES (8,9,'-1866544013697.19');
--Testcase 360:
INSERT INTO num_exp_div VALUES (8,9,'-.00300403532938582735');
--Testcase 361:
INSERT INTO num_exp_add VALUES (9,0,'-24926804.045047420');
--Testcase 362:
INSERT INTO num_exp_sub VALUES (9,0,'-24926804.045047420');
--Testcase 363:
INSERT INTO num_exp_mul VALUES (9,0,'0');
--Testcase 364:
INSERT INTO num_exp_div VALUES (9,0,'NaN');
--Testcase 365:
INSERT INTO num_exp_add VALUES (9,1,'-24926804.045047420');
--Testcase 366:
INSERT INTO num_exp_sub VALUES (9,1,'-24926804.045047420');
--Testcase 367:
INSERT INTO num_exp_mul VALUES (9,1,'0');
--Testcase 368:
INSERT INTO num_exp_div VALUES (9,1,'NaN');
--Testcase 369:
INSERT INTO num_exp_add VALUES (9,2,'-59265296.2604444');
--Testcase 370:
INSERT INTO num_exp_sub VALUES (9,2,'9411688.1703496');
--Testcase 371:
INSERT INTO num_exp_mul VALUES (9,2,'855948866655587.0');
--Testcase 372:
INSERT INTO num_exp_div VALUES (9,2,'.72591434384152961526');
--Testcase 373:
INSERT INTO num_exp_add VALUES (9,3,'-24926799.735047420');
--Testcase 374:
INSERT INTO num_exp_sub VALUES (9,3,'-24926808.355047420');
--Testcase 375:
INSERT INTO num_exp_mul VALUES (9,3,'-107434525.43415438020');
--Testcase 376:
INSERT INTO num_exp_div VALUES (9,3,'-5783481.21694835');
--Testcase 377:
INSERT INTO num_exp_add VALUES (9,4,'-17127342.633147420');
--Testcase 378:
INSERT INTO num_exp_sub VALUES (9,4,'-32726265.456947420');
--Testcase 379:
INSERT INTO num_exp_mul VALUES (9,4,'-194415646271340.1815956522980');
--Testcase 380:
INSERT INTO num_exp_div VALUES (9,4,'-3.19596478892958416484');
--Testcase 381:
INSERT INTO num_exp_add VALUES (9,5,'-24910407.006556420');
--Testcase 382:
INSERT INTO num_exp_sub VALUES (9,5,'-24943201.083538420');
--Testcase 383:
INSERT INTO num_exp_mul VALUES (9,5,'-408725765384.257043660243220');
--Testcase 384:
INSERT INTO num_exp_div VALUES (9,5,'-1520.20159364322004505807');
--Testcase 385:
INSERT INTO num_exp_add VALUES (9,6,'-24832902.4674171');
--Testcase 386:
INSERT INTO num_exp_sub VALUES (9,6,'-25020705.622677680');
--Testcase 387:
INSERT INTO num_exp_mul VALUES (9,6,'-2340666225110.29929521292692920');
--Testcase 388:
INSERT INTO num_exp_div VALUES (9,6,'-265.45671195426965751280');
--Testcase 389:
INSERT INTO num_exp_add VALUES (9,7,'-107955289.045047420');
--Testcase 390:
INSERT INTO num_exp_sub VALUES (9,7,'58101680.954952580');
--Testcase 391:
INSERT INTO num_exp_mul VALUES (9,7,'2069634775752160');
--Testcase 392:
INSERT INTO num_exp_div VALUES (9,7,'.30021990699995814689');
--Testcase 393:
INSERT INTO num_exp_add VALUES (9,8,'-24851923.045047420');
--Testcase 394:
INSERT INTO num_exp_sub VALUES (9,8,'-25001685.045047420');
--Testcase 395:
INSERT INTO num_exp_mul VALUES (9,8,'-1866544013697.19');
--Testcase 396:
INSERT INTO num_exp_div VALUES (9,8,'-332.88556569820675471748');
--Testcase 397:
INSERT INTO num_exp_add VALUES (9,9,'-49853608.090094840');
--Testcase 398:
INSERT INTO num_exp_sub VALUES (9,9,'0');
--Testcase 399:
INSERT INTO num_exp_mul VALUES (9,9,'621345559900191.0');
--Testcase 400:
INSERT INTO num_exp_div VALUES (9,9,'1.00000000000000000000');
COMMIT TRANSACTION;
BEGIN TRANSACTION;
--Testcase 401:
INSERT INTO num_exp_sqrt VALUES (0,'0');
--Testcase 402:
INSERT INTO num_exp_sqrt VALUES (1,'0');
--Testcase 403:
INSERT INTO num_exp_sqrt VALUES (2,'5859.90547836712524903505');
--Testcase 404:
INSERT INTO num_exp_sqrt VALUES (3,'2.07605394920266944396');
--Testcase 405:
INSERT INTO num_exp_sqrt VALUES (4,'2792.75158435189147418923');
--Testcase 406:
INSERT INTO num_exp_sqrt VALUES (5,'128.05092147657509145473');
--Testcase 407:
INSERT INTO num_exp_sqrt VALUES (6,'306.43364311096782703406');
--Testcase 408:
INSERT INTO num_exp_sqrt VALUES (7,'9111.99676251039939975230');
--Testcase 409:
INSERT INTO num_exp_sqrt VALUES (8,'273.64392922189960397542');
--Testcase 410:
INSERT INTO num_exp_sqrt VALUES (9,'4992.67503899937593364766');
COMMIT TRANSACTION;
BEGIN TRANSACTION;
--Testcase 411:
INSERT INTO num_exp_ln VALUES (0,'NaN');
--Testcase 412:
INSERT INTO num_exp_ln VALUES (1,'NaN');
--Testcase 413:
INSERT INTO num_exp_ln VALUES (2,'17.35177750493897715514');
--Testcase 414:
INSERT INTO num_exp_ln VALUES (3,'1.46093790411565641971');
--Testcase 415:
INSERT INTO num_exp_ln VALUES (4,'15.86956523951936572464');
--Testcase 416:
INSERT INTO num_exp_ln VALUES (5,'9.70485601768871834038');
--Testcase 417:
INSERT INTO num_exp_ln VALUES (6,'11.45000246622944403127');
--Testcase 418:
INSERT INTO num_exp_ln VALUES (7,'18.23469429965478772991');
--Testcase 419:
INSERT INTO num_exp_ln VALUES (8,'11.22365546576315513668');
--Testcase 420:
INSERT INTO num_exp_ln VALUES (9,'17.03145425013166006962');
COMMIT TRANSACTION;
BEGIN TRANSACTION;
--Testcase 421:
INSERT INTO num_exp_log10 VALUES (0,'NaN');
--Testcase 422:
INSERT INTO num_exp_log10 VALUES (1,'NaN');
--Testcase 423:
INSERT INTO num_exp_log10 VALUES (2,'7.53578122160797276459');
--Testcase 424:
INSERT INTO num_exp_log10 VALUES (3,'.63447727016073160075');
--Testcase 425:
INSERT INTO num_exp_log10 VALUES (4,'6.89206461372691743345');
--Testcase 426:
INSERT INTO num_exp_log10 VALUES (5,'4.21476541614777768626');
--Testcase 427:
INSERT INTO num_exp_log10 VALUES (6,'4.97267288886207207671');
--Testcase 428:
INSERT INTO num_exp_log10 VALUES (7,'7.91922711353275546914');
--Testcase 429:
INSERT INTO num_exp_log10 VALUES (8,'4.87437163556421004138');
--Testcase 430:
INSERT INTO num_exp_log10 VALUES (9,'7.39666659961986567059');
COMMIT TRANSACTION;
BEGIN TRANSACTION;
--Testcase 431:
INSERT INTO num_exp_power_10_ln VALUES (0,'NaN');
--Testcase 432:
INSERT INTO num_exp_power_10_ln VALUES (1,'NaN');
--Testcase 433:
INSERT INTO num_exp_power_10_ln VALUES (2,'224790267919917248');
--Testcase 434:
INSERT INTO num_exp_power_10_ln VALUES (3,'28.90266599445155957393');
--Testcase 435:
INSERT INTO num_exp_power_10_ln VALUES (4,'7405685069594999.07733999469386277636');
--Testcase 436:
INSERT INTO num_exp_power_10_ln VALUES (5,'5068226527.32127265408584640098');
--Testcase 437:
INSERT INTO num_exp_power_10_ln VALUES (6,'281839893606.99372343357047819067');
--Testcase 438:
INSERT INTO num_exp_power_10_ln VALUES (7,'1716699575118597095.42330819910640247627');
--Testcase 439:
INSERT INTO num_exp_power_10_ln VALUES (8,'167361463828.07491320069016125952');
--Testcase 440:
INSERT INTO num_exp_power_10_ln VALUES (9,'107511333880051808');
COMMIT TRANSACTION;
BEGIN TRANSACTION;
--Testcase 441:
INSERT INTO num_data VALUES (0, '0');
--Testcase 442:
INSERT INTO num_data VALUES (1, '0');
--Testcase 443:
INSERT INTO num_data VALUES (2, '-34338492.215397047');
--Testcase 444:
INSERT INTO num_data VALUES (3, '4.31');
--Testcase 445:
INSERT INTO num_data VALUES (4, '7799461.4119');
--Testcase 446:
INSERT INTO num_data VALUES (5, '16397.038491');
--Testcase 447:
INSERT INTO num_data VALUES (6, '93901.57763026');
--Testcase 448:
INSERT INTO num_data VALUES (7, '-83028485');
--Testcase 449:
INSERT INTO num_data VALUES (8, '74881');
--Testcase 450:
INSERT INTO num_data VALUES (9, '-24926804.045047420');
COMMIT TRANSACTION;
-- ******************************
-- * Now check the behaviour of the NUMERIC type
-- ******************************
-- ******************************
-- * Addition check
-- ******************************
--Testcase 451:
DELETE FROM num_result;
--Testcase 452:
INSERT INTO num_result SELECT t1.id, t2.id, t1.val + t2.val
    FROM num_data t1, num_data t2;
--Testcase 453:
SELECT t1.id1, t1.id2, t1.result, t2.expected
    FROM num_result t1, num_exp_add t2
    WHERE t1.id1 = t2.id1 AND t1.id2 = t2.id2
    AND t1.result != t2.expected;
 id1 | id2 | result | expected 
-----+-----+--------+----------
(0 rows)

--Testcase 454:
DELETE FROM num_result;
--Testcase 455:
INSERT INTO num_result SELECT t1.id, t2.id, round(t1.val + t2.val, 10)
    FROM num_data t1, num_data t2;
--Testcase 456:
SELECT t1.id1, t1.id2, t1.result, round(t2.expected, 10) as expected
    FROM num_result t1, num_exp_add t2
    WHERE t1.id1 = t2.id1 AND t1.id2 = t2.id2
    AND t1.result != round(t2.expected, 10);
 id1 | id2 | result | expected 
-----+-----+--------+----------
(0 rows)

-- ******************************
-- * Subtraction check
-- ******************************
--Testcase 457:
DELETE FROM num_result;
--Testcase 458:
INSERT INTO num_result SELECT t1.id, t2.id, t1.val - t2.val
    FROM num_data t1, num_data t2;
--Testcase 459:
SELECT t1.id1, t1.id2, t1.result, t2.expected
    FROM num_result t1, num_exp_sub t2
    WHERE t1.id1 = t2.id1 AND t1.id2 = t2.id2
    AND t1.result != t2.expected;
 id1 | id2 | result | expected 
-----+-----+--------+----------
(0 rows)

--Testcase 460:
DELETE FROM num_result;
--Testcase 461:
INSERT INTO num_result SELECT t1.id, t2.id, round(t1.val - t2.val, 40)
    FROM num_data t1, num_data t2;
--Testcase 462:
SELECT t1.id1, t1.id2, t1.result, round(t2.expected, 40)
    FROM num_result t1, num_exp_sub t2
    WHERE t1.id1 = t2.id1 AND t1.id2 = t2.id2
    AND t1.result != round(t2.expected, 40);
 id1 | id2 | result | round 
-----+-----+--------+-------
(0 rows)

-- ******************************
-- * Multiply check
-- ******************************
--Testcase 463:
DELETE FROM num_result;
--Testcase 464:
INSERT INTO num_result SELECT t1.id, t2.id, t1.val * t2.val
    FROM num_data t1, num_data t2;
--Testcase 465:
SELECT t1.id1, t1.id2, t1.result, t2.expected
    FROM num_result t1, num_exp_mul t2
    WHERE t1.id1 = t2.id1 AND t1.id2 = t2.id2
    AND t1.result != t2.expected;
 id1 | id2 | result | expected 
-----+-----+--------+----------
(0 rows)

--Testcase 466:
DELETE FROM num_result;
--Testcase 467:
INSERT INTO num_result SELECT t1.id, t2.id, round(t1.val * t2.val, 30)
    FROM num_data t1, num_data t2;
--Testcase 468:
SELECT t1.id1, t1.id2, t1.result, round(t2.expected, 30) as expected
    FROM num_result t1, num_exp_mul t2
    WHERE t1.id1 = t2.id1 AND t1.id2 = t2.id2
    AND t1.result != round(t2.expected, 30);
 id1 | id2 | result | expected 
-----+-----+--------+----------
(0 rows)

-- ******************************
-- * Division check
-- ******************************
--Testcase 469:
DELETE FROM num_result;
--Testcase 470:
INSERT INTO num_result SELECT t1.id, t2.id, t1.val / t2.val
    FROM num_data t1, num_data t2
    WHERE t2.val != '0.0';
--Testcase 471:
SELECT t1.id1, t1.id2, t1.result, t2.expected
    FROM num_result t1, num_exp_div t2
    WHERE t1.id1 = t2.id1 AND t1.id2 = t2.id2
    AND t1.result != t2.expected;
 id1 | id2 | result | expected 
-----+-----+--------+----------
(0 rows)

--Testcase 472:
DELETE FROM num_result;
--Testcase 473:
INSERT INTO num_result SELECT t1.id, t2.id, round(t1.val / t2.val, 80)
    FROM num_data t1, num_data t2
    WHERE t2.val != '0.0';
--Testcase 474:
SELECT t1.id1, t1.id2, t1.result, round(t2.expected, 80) as expected
    FROM num_result t1, num_exp_div t2
    WHERE t1.id1 = t2.id1 AND t1.id2 = t2.id2
    AND t1.result != round(t2.expected, 80);
 id1 | id2 | result | expected 
-----+-----+--------+----------
(0 rows)

-- ******************************
-- * Square root check
-- ******************************
--Testcase 475:
DELETE FROM num_result;
--Testcase 476:
INSERT INTO num_result SELECT id, 0, SQRT(ABS(val))
    FROM num_data;
--Testcase 477:
SELECT t1.id1, t1.result, t2.expected
    FROM num_result t1, num_exp_sqrt t2
    WHERE t1.id1 = t2.id
    AND t1.result != t2.expected;
 id1 | result | expected 
-----+--------+----------
(0 rows)

-- ******************************
-- * Natural logarithm check
-- ******************************
--Testcase 478:
DELETE FROM num_result;
--Testcase 479:
INSERT INTO num_result SELECT id, 0, LN(ABS(val))
    FROM num_data
    WHERE val != '0.0';
--Testcase 480:
SELECT t1.id1, t1.result, t2.expected
    FROM num_result t1, num_exp_ln t2
    WHERE t1.id1 = t2.id
    AND t1.result != t2.expected;
 id1 | result | expected 
-----+--------+----------
(0 rows)

-- ******************************
-- * Logarithm base 10 check
-- ******************************
--Testcase 481:
DELETE FROM num_result;
--Testcase 482:
INSERT INTO num_result SELECT id, 0, LOG(numeric '10', ABS(val))
    FROM num_data
    WHERE val != '0.0';
--Testcase 483:
SELECT t1.id1, t1.result, t2.expected
    FROM num_result t1, num_exp_log10 t2
    WHERE t1.id1 = t2.id
    AND t1.result != t2.expected;
 id1 | result | expected 
-----+--------+----------
(0 rows)

-- ******************************
-- * POWER(10, LN(value)) check
-- ******************************
--Testcase 484:
DELETE FROM num_result;
--Testcase 485:
INSERT INTO num_result SELECT id, 0, POWER(numeric '10', LN(ABS(round(val,200))))
    FROM num_data
    WHERE val != '0.0';
--Testcase 486:
SELECT t1.id1, t1.result, t2.expected
    FROM num_result t1, num_exp_power_10_ln t2
    WHERE t1.id1 = t2.id
    AND t1.result != t2.expected;
 id1 | result | expected 
-----+--------+----------
(0 rows)

-- ******************************
-- * miscellaneous checks for things that have been broken in the past...
-- ******************************
-- numeric AVG used to fail on some platforms
--Testcase 487:
SELECT AVG(val) FROM num_data;
        avg        
-------------------
 -13430913.5922423
(1 row)

--Testcase 488:
SELECT STDDEV(val) FROM num_data;
          stddev           
---------------------------
 27791203.2875883484501033
(1 row)

--Testcase 489:
SELECT VARIANCE(val) FROM num_data;
             variance             
----------------------------------
 772350980172061.4271301683648535
(1 row)

-- Check for appropriate rounding and overflow
CREATE FOREIGN TABLE fract_only (id int, val numeric(4,4)) SERVER sqlite_svr;
--Testcase 490:
INSERT INTO fract_only VALUES (1, '0.0');
--Testcase 491:
INSERT INTO fract_only VALUES (2, '0.1');
--Testcase 492:
INSERT INTO fract_only VALUES (3, '1.0');	-- should fail
ERROR:  numeric field overflow
DETAIL:  A field with precision 4, scale 4 must round to an absolute value less than 1.
--Testcase 493:
INSERT INTO fract_only VALUES (4, '-0.9999');
--Testcase 494:
INSERT INTO fract_only VALUES (5, '0.99994');
--Testcase 495:
INSERT INTO fract_only VALUES (6, '0.99995');  -- should fail
ERROR:  numeric field overflow
DETAIL:  A field with precision 4, scale 4 must round to an absolute value less than 1.
--Testcase 496:
INSERT INTO fract_only VALUES (7, '0.00001');
--Testcase 497:
INSERT INTO fract_only VALUES (8, '0.00017');
--Testcase 498:
SELECT * FROM fract_only;
 id |   val   
----+---------
  1 |       0
  2 |     0.1
  4 | -0.9999
  5 |  0.9999
  7 |       0
  8 |  0.0002
(6 rows)

DROP FOREIGN TABLE fract_only;
-- Simple check that ceil(), floor(), and round() work correctly
CREATE FOREIGN TABLE ceil_floor_round (a numeric OPTIONS (key 'true')) SERVER sqlite_svr;
--Testcase 499:
INSERT INTO ceil_floor_round VALUES ('-5.5');
--Testcase 500:
INSERT INTO ceil_floor_round VALUES ('-5.499999');
--Testcase 501:
INSERT INTO ceil_floor_round VALUES ('9.5');
--Testcase 502:
INSERT INTO ceil_floor_round VALUES ('9.4999999');
--Testcase 503:
INSERT INTO ceil_floor_round VALUES ('0.0');
--Testcase 504:
INSERT INTO ceil_floor_round VALUES ('0.0000001');
--Testcase 505:
INSERT INTO ceil_floor_round VALUES ('-0.000001');
--Testcase 506:
SELECT a, ceil(a), ceiling(a), floor(a), round(a) FROM ceil_floor_round;
     a      | ceil | ceiling | floor | round 
------------+------+---------+-------+-------
       -5.5 |   -5 |      -5 |    -6 |    -6
  -5.499999 |   -5 |      -5 |    -6 |    -5
        9.5 |   10 |      10 |     9 |    10
  9.4999999 |   10 |      10 |     9 |     9
          0 |    0 |       0 |     0 |     0
 0.00000010 |    1 |       1 |     0 |     0
 -0.0000010 |    0 |       0 |    -1 |     0
(7 rows)

-- normal operation
CREATE FOREIGN TABLE width_bucket_test (
	operand_num numeric OPTIONS (key 'true'),
	operand_f8 float8
) SERVER sqlite_svr;
--Testcase 507:
INSERT INTO width_bucket_test (operand_num) VALUES
(-5.2),
(-0.0000000001),
(0.000000000001),
(1),
(1.99999999999999),
(2),
(2.00000000000001),
(3),
(4),
(4.5),
(5),
(5.5),
(6),
(7),
(8),
(9),
(9.99999999999999),
(10),
(10.0000000000001);
--Testcase 508:
UPDATE width_bucket_test SET operand_f8 = operand_num::float8;
--Testcase 509:
SELECT
    operand_num,
    width_bucket(operand_num, 0, 10, 5) AS wb_1,
    width_bucket(operand_f8, 0, 10, 5) AS wb_1f,
    width_bucket(operand_num, 10, 0, 5) AS wb_2,
    width_bucket(operand_f8, 10, 0, 5) AS wb_2f,
    width_bucket(operand_num, 2, 8, 4) AS wb_3,
    width_bucket(operand_f8, 2, 8, 4) AS wb_3f,
    width_bucket(operand_num, 5.0, 5.5, 20) AS wb_4,
    width_bucket(operand_f8, 5.0, 5.5, 20) AS wb_4f,
    width_bucket(operand_num, -25, 25, 10) AS wb_5,
    width_bucket(operand_f8, -25, 25, 10) AS wb_5f
    FROM width_bucket_test;
   operand_num    | wb_1 | wb_1f | wb_2 | wb_2f | wb_3 | wb_3f | wb_4 | wb_4f | wb_5 | wb_5f 
------------------+------+-------+------+-------+------+-------+------+-------+------+-------
             -5.2 |    0 |     0 |    6 |     6 |    0 |     0 |    0 |     0 |    4 |     4
   -0.00000000010 |    0 |     0 |    6 |     6 |    0 |     0 |    0 |     0 |    5 |     5
  0.0000000000010 |    1 |     1 |    5 |     5 |    0 |     0 |    0 |     0 |    6 |     6
                1 |    1 |     1 |    5 |     5 |    0 |     0 |    0 |     0 |    6 |     6
 1.99999999999999 |    1 |     1 |    5 |     5 |    0 |     0 |    0 |     0 |    6 |     6
                2 |    2 |     2 |    5 |     5 |    1 |     1 |    0 |     0 |    6 |     6
 2.00000000000001 |    2 |     2 |    4 |     4 |    1 |     1 |    0 |     0 |    6 |     6
                3 |    2 |     2 |    4 |     4 |    1 |     1 |    0 |     0 |    6 |     6
                4 |    3 |     3 |    4 |     4 |    2 |     2 |    0 |     0 |    6 |     6
              4.5 |    3 |     3 |    3 |     3 |    2 |     2 |    0 |     0 |    6 |     6
                5 |    3 |     3 |    3 |     3 |    3 |     3 |    1 |     1 |    7 |     7
              5.5 |    3 |     3 |    3 |     3 |    3 |     3 |   21 |    21 |    7 |     7
                6 |    4 |     4 |    3 |     3 |    3 |     3 |   21 |    21 |    7 |     7
                7 |    4 |     4 |    2 |     2 |    4 |     4 |   21 |    21 |    7 |     7
                8 |    5 |     5 |    2 |     2 |    5 |     5 |   21 |    21 |    7 |     7
                9 |    5 |     5 |    1 |     1 |    5 |     5 |   21 |    21 |    7 |     7
 9.99999999999999 |    5 |     5 |    1 |     1 |    5 |     5 |   21 |    21 |    7 |     7
               10 |    6 |     6 |    1 |     1 |    5 |     5 |   21 |    21 |    8 |     8
 10.0000000000001 |    6 |     6 |    0 |     0 |    5 |     5 |   21 |    21 |    8 |     8
(19 rows)

-- for float8 only, check positive and negative infinity: we require
-- finite bucket bounds, but allow an infinite operand
--Testcase 510:
SELECT width_bucket(0.0::float8, 'Infinity'::float8, 5, 10); -- error
ERROR:  lower and upper bounds must be finite
--Testcase 511:
SELECT width_bucket(0.0::float8, 5, '-Infinity'::float8, 20); -- error
ERROR:  lower and upper bounds must be finite
--Testcase 512:
SELECT width_bucket('Infinity'::float8, 1, 10, 10),
       width_bucket('-Infinity'::float8, 1, 10, 10);
 width_bucket | width_bucket 
--------------+--------------
           11 |            0
(1 row)

DROP FOREIGN TABLE width_bucket_test;
-- TO_CHAR()
--
--Testcase 513:
SELECT '' AS to_char_1, to_char(val, '9G999G999G999G999G999')
	FROM num_data;
 to_char_1 |        to_char         
-----------+------------------------
           |                      0
           |                      0
           |            -34,338,492
           |                      4
           |              7,799,461
           |                 16,397
           |                 93,902
           |            -83,028,485
           |                 74,881
           |            -24,926,804
(10 rows)

--Testcase 514:
SELECT '' AS to_char_2, to_char(val, '9G999G999G999G999G999D999G999G999G999G999')
	FROM num_data;
 to_char_2 |                  to_char                   
-----------+--------------------------------------------
           |                       .000,000,000,000,000
           |                       .000,000,000,000,000
           |            -34,338,492.215,397,000,000,000
           |                      4.310,000,000,000,000
           |              7,799,461.411,900,000,000,000
           |                 16,397.038,491,000,000,000
           |                 93,901.577,630,260,000,000
           |            -83,028,485.000,000,000,000,000
           |                 74,881.000,000,000,000,000
           |            -24,926,804.045,047,400,000,000
(10 rows)

--Testcase 515:
SELECT '' AS to_char_3, to_char(val, '9999999999999999.999999999999999PR')
	FROM num_data;
 to_char_3 |              to_char               
-----------+------------------------------------
           |                  .000000000000000 
           |                  .000000000000000 
           |         <34338492.215397000000000>
           |                 4.310000000000000 
           |           7799461.411900000000000 
           |             16397.038491000000000 
           |             93901.577630260000000 
           |         <83028485.000000000000000>
           |             74881.000000000000000 
           |         <24926804.045047400000000>
(10 rows)

--Testcase 516:
SELECT '' AS to_char_4, to_char(val, '9999999999999999.999999999999999S')
	FROM num_data;
 to_char_4 |              to_char              
-----------+-----------------------------------
           |                 .000000000000000+
           |                 .000000000000000+
           |         34338492.215397000000000-
           |                4.310000000000000+
           |          7799461.411900000000000+
           |            16397.038491000000000+
           |            93901.577630260000000+
           |         83028485.000000000000000-
           |            74881.000000000000000+
           |         24926804.045047400000000-
(10 rows)

--Testcase 517:
SELECT '' AS to_char_5,  to_char(val, 'MI9999999999999999.999999999999999')     FROM num_data;
 to_char_5 |              to_char              
-----------+-----------------------------------
           |                  .000000000000000
           |                  .000000000000000
           | -        34338492.215397000000000
           |                 4.310000000000000
           |           7799461.411900000000000
           |             16397.038491000000000
           |             93901.577630260000000
           | -        83028485.000000000000000
           |             74881.000000000000000
           | -        24926804.045047400000000
(10 rows)

--Testcase 518:
SELECT '' AS to_char_6,  to_char(val, 'FMS9999999999999999.999999999999999')    FROM num_data;
 to_char_6 |      to_char      
-----------+-------------------
           | +0.
           | +0.
           | -34338492.215397
           | +4.31
           | +7799461.4119
           | +16397.038491
           | +93901.57763026
           | -83028485.
           | +74881.
           | -24926804.0450474
(10 rows)

--Testcase 519:
SELECT '' AS to_char_7,  to_char(val, 'FM9999999999999999.999999999999999THPR') FROM num_data;
 to_char_7 |      to_char       
-----------+--------------------
           | 0.
           | 0.
           | <34338492.215397>
           | 4.31
           | 7799461.4119
           | 16397.038491
           | 93901.57763026
           | <83028485.>
           | 74881.
           | <24926804.0450474>
(10 rows)

--Testcase 520:
SELECT '' AS to_char_8,  to_char(val, 'SG9999999999999999.999999999999999th')   FROM num_data;
 to_char_8 |              to_char              
-----------+-----------------------------------
           | +                .000000000000000
           | +                .000000000000000
           | -        34338492.215397000000000
           | +               4.310000000000000
           | +         7799461.411900000000000
           | +           16397.038491000000000
           | +           93901.577630260000000
           | -        83028485.000000000000000
           | +           74881.000000000000000
           | -        24926804.045047400000000
(10 rows)

--Testcase 521:
SELECT '' AS to_char_9,  to_char(val, '0999999999999999.999999999999999')       FROM num_data;
 to_char_9 |              to_char              
-----------+-----------------------------------
           |  0000000000000000.000000000000000
           |  0000000000000000.000000000000000
           | -0000000034338492.215397000000000
           |  0000000000000004.310000000000000
           |  0000000007799461.411900000000000
           |  0000000000016397.038491000000000
           |  0000000000093901.577630260000000
           | -0000000083028485.000000000000000
           |  0000000000074881.000000000000000
           | -0000000024926804.045047400000000
(10 rows)

--Testcase 522:
SELECT '' AS to_char_10, to_char(val, 'S0999999999999999.999999999999999')      FROM num_data;
 to_char_10 |              to_char              
------------+-----------------------------------
            | +0000000000000000.000000000000000
            | +0000000000000000.000000000000000
            | -0000000034338492.215397000000000
            | +0000000000000004.310000000000000
            | +0000000007799461.411900000000000
            | +0000000000016397.038491000000000
            | +0000000000093901.577630260000000
            | -0000000083028485.000000000000000
            | +0000000000074881.000000000000000
            | -0000000024926804.045047400000000
(10 rows)

--Testcase 523:
SELECT '' AS to_char_11, to_char(val, 'FM0999999999999999.999999999999999')     FROM num_data;
 to_char_11 |          to_char          
------------+---------------------------
            | 0000000000000000.
            | 0000000000000000.
            | -0000000034338492.215397
            | 0000000000000004.31
            | 0000000007799461.4119
            | 0000000000016397.038491
            | 0000000000093901.57763026
            | -0000000083028485.
            | 0000000000074881.
            | -0000000024926804.0450474
(10 rows)

--Testcase 524:
SELECT '' AS to_char_12, to_char(val, 'FM9999999999999999.099999999999999') 	FROM num_data;
 to_char_12 |      to_char      
------------+-------------------
            | .0
            | .0
            | -34338492.215397
            | 4.31
            | 7799461.4119
            | 16397.038491
            | 93901.57763026
            | -83028485.0
            | 74881.0
            | -24926804.0450474
(10 rows)

--Testcase 525:
SELECT '' AS to_char_13, to_char(val, 'FM9999999999990999.990999999999999') 	FROM num_data;
 to_char_13 |      to_char      
------------+-------------------
            | 0000.000
            | 0000.000
            | -34338492.215397
            | 0004.310
            | 7799461.4119
            | 16397.038491
            | 93901.57763026
            | -83028485.000
            | 74881.000
            | -24926804.0450474
(10 rows)

--Testcase 526:
SELECT '' AS to_char_14, to_char(val, 'FM0999999999999999.999909999999999') 	FROM num_data;
 to_char_14 |          to_char          
------------+---------------------------
            | 0000000000000000.00000
            | 0000000000000000.00000
            | -0000000034338492.215397
            | 0000000000000004.31000
            | 0000000007799461.41190
            | 0000000000016397.038491
            | 0000000000093901.57763026
            | -0000000083028485.00000
            | 0000000000074881.00000
            | -0000000024926804.0450474
(10 rows)

--Testcase 527:
SELECT '' AS to_char_15, to_char(val, 'FM9999999990999999.099999999999999') 	FROM num_data;
 to_char_15 |      to_char      
------------+-------------------
            | 0000000.0
            | 0000000.0
            | -34338492.215397
            | 0000004.31
            | 7799461.4119
            | 0016397.038491
            | 0093901.57763026
            | -83028485.0
            | 0074881.0
            | -24926804.0450474
(10 rows)

--Testcase 528:
SELECT '' AS to_char_16, to_char(val, 'L9999999999999999.099999999999999')	FROM num_data;
 to_char_16 |              to_char               
------------+------------------------------------
            |                   .000000000000000
            |                   .000000000000000
            |          -34338492.215397000000000
            |                  4.310000000000000
            |            7799461.411900000000000
            |              16397.038491000000000
            |              93901.577630260000000
            |          -83028485.000000000000000
            |              74881.000000000000000
            |          -24926804.045047400000000
(10 rows)

--Testcase 529:
SELECT '' AS to_char_17, to_char(val, 'FM9999999999999999.99999999999999')	FROM num_data;
 to_char_17 |      to_char      
------------+-------------------
            | 0.
            | 0.
            | -34338492.215397
            | 4.31
            | 7799461.4119
            | 16397.038491
            | 93901.57763026
            | -83028485.
            | 74881.
            | -24926804.0450474
(10 rows)

--Testcase 530:
SELECT '' AS to_char_18, to_char(val, 'S 9 9 9 9 9 9 9 9 9 9 9 9 9 9 9 9 . 9 9 9 9 9 9 9 9 9 9 9 9 9 9 9 9 9') FROM num_data;
 to_char_18 |                                to_char                                
------------+-----------------------------------------------------------------------
            |                                  +. 0 0 0 0 0 0 0 0 0 0 0 0 0 0 0 0 0
            |                                  +. 0 0 0 0 0 0 0 0 0 0 0 0 0 0 0 0 0
            |                  -3 4 3 3 8 4 9 2 . 2 1 5 3 9 7 0 0 0 0 0 0 0 0 0 0 0
            |                                +4 . 3 1 0 0 0 0 0 0 0 0 0 0 0 0 0 0 0
            |                    +7 7 9 9 4 6 1 . 4 1 1 9 0 0 0 0 0 0 0 0 0 0 0 0 0
            |                        +1 6 3 9 7 . 0 3 8 4 9 1 0 0 0 0 0 0 0 0 0 0 0
            |                        +9 3 9 0 1 . 5 7 7 6 3 0 2 6 0 0 0 0 0 0 0 0 0
            |                  -8 3 0 2 8 4 8 5 . 0 0 0 0 0 0 0 0 0 0 0 0 0 0 0 0 0
            |                        +7 4 8 8 1 . 0 0 0 0 0 0 0 0 0 0 0 0 0 0 0 0 0
            |                  -2 4 9 2 6 8 0 4 . 0 4 5 0 4 7 4 0 0 0 0 0 0 0 0 0 0
(10 rows)

--Testcase 531:
SELECT '' AS to_char_19, to_char(val, 'FMS 9 9 9 9 9 9 9 9 9 9 9 9 9 9 9 9 . 9 9 9 9 9 9 9 9 9 9 9 9 9 9 9 9 9') FROM num_data;
 to_char_19 |                       to_char                       
------------+-----------------------------------------------------
            |                 +0 .                 
            |                 +0 .                 
            |          -3 4 3 3 8 4 9 2 . 2 1 5 3 9 7           
            |                 +4 . 3 1               
            |           +7 7 9 9 4 6 1 . 4 1 1 9             
            |             +1 6 3 9 7 . 0 3 8 4 9 1           
            |             +9 3 9 0 1 . 5 7 7 6 3 0 2 6         
            |          -8 3 0 2 8 4 8 5 .                 
            |             +7 4 8 8 1 .                 
            |          -2 4 9 2 6 8 0 4 . 0 4 5 0 4 7 4          
(10 rows)

--Testcase 532:
SELECT '' AS to_char_20, to_char(val, E'99999 "text" 9999 "9999" 999 "\\"text between quote marks\\"" 9999') FROM num_data;
 to_char_20 |                          to_char                          
------------+-----------------------------------------------------------
            |       text      9999     "text between quote marks"     0
            |       text      9999     "text between quote marks"     0
            |       text    -3 9999 433 "text between quote marks" 8492
            |       text      9999     "text between quote marks"     4
            |       text      9999  779 "text between quote marks" 9461
            |       text      9999    1 "text between quote marks" 6397
            |       text      9999    9 "text between quote marks" 3902
            |       text    -8 9999 302 "text between quote marks" 8485
            |       text      9999    7 "text between quote marks" 4881
            |       text    -2 9999 492 "text between quote marks" 6804
(10 rows)

--Testcase 533:
SELECT '' AS to_char_21, to_char(val, '999999SG9999999999')			FROM num_data;
 to_char_21 |      to_char      
------------+-------------------
            |       +         0
            |       +         0
            |       -  34338492
            |       +         4
            |       +   7799461
            |       +     16397
            |       +     93902
            |       -  83028485
            |       +     74881
            |       -  24926804
(10 rows)

--Testcase 534:
SELECT '' AS to_char_22, to_char(val, 'FM9999999999999999.999999999999999')	FROM num_data;
 to_char_22 |      to_char      
------------+-------------------
            | 0.
            | 0.
            | -34338492.215397
            | 4.31
            | 7799461.4119
            | 16397.038491
            | 93901.57763026
            | -83028485.
            | 74881.
            | -24926804.0450474
(10 rows)

--Testcase 535:
SELECT '' AS to_char_23, to_char(val, '9.999EEEE')				FROM num_data;
 to_char_23 |  to_char   
------------+------------
            |  0.000e+00
            |  0.000e+00
            | -3.434e+07
            |  4.310e+00
            |  7.799e+06
            |  1.640e+04
            |  9.390e+04
            | -8.303e+07
            |  7.488e+04
            | -2.493e+07
(10 rows)

--Testcase 536:
DELETE FROM ceil_floor_round;
--Testcase 537:
INSERT INTO ceil_floor_round VALUES ('100'::numeric);
--Testcase 538:
SELECT '' AS to_char_24, to_char(a, 'FM999.9') FROM ceil_floor_round;
 to_char_24 | to_char 
------------+---------
            | 100.
(1 row)

--Testcase 539:
SELECT '' AS to_char_25, to_char(a, 'FM999.') FROM ceil_floor_round;
 to_char_25 | to_char 
------------+---------
            | 100
(1 row)

--Testcase 540:
SELECT '' AS to_char_26, to_char(a, 'FM999') FROM ceil_floor_round;
 to_char_26 | to_char 
------------+---------
            | 100
(1 row)

-- Check parsing of literal text in a format string
--Testcase 541:
SELECT '' AS to_char_27, to_char(a, 'foo999') FROM ceil_floor_round;
 to_char_27 | to_char 
------------+---------
            | foo 100
(1 row)

--Testcase 542:
SELECT '' AS to_char_28, to_char(a, 'f\oo999') FROM ceil_floor_round;
 to_char_28 | to_char  
------------+----------
            | f\oo 100
(1 row)

--Testcase 543:
SELECT '' AS to_char_29, to_char(a, 'f\\oo999') FROM ceil_floor_round;
 to_char_29 |  to_char  
------------+-----------
            | f\\oo 100
(1 row)

--Testcase 544:
SELECT '' AS to_char_30, to_char(a, 'f\"oo999') FROM ceil_floor_round;
 to_char_30 | to_char  
------------+----------
            | f"oo 100
(1 row)

--Testcase 545:
SELECT '' AS to_char_31, to_char(a, 'f\\"oo999') FROM ceil_floor_round;
 to_char_31 |  to_char  
------------+-----------
            | f\"oo 100
(1 row)

--Testcase 546:
SELECT '' AS to_char_32, to_char(a, 'f"ool"999') FROM ceil_floor_round;
 to_char_32 | to_char  
------------+----------
            | fool 100
(1 row)

--Testcase 547:
SELECT '' AS to_char_33, to_char(a, 'f"\ool"999') FROM ceil_floor_round;
 to_char_33 | to_char  
------------+----------
            | fool 100
(1 row)

--Testcase 548:
SELECT '' AS to_char_34, to_char(a, 'f"\\ool"999') FROM ceil_floor_round;
 to_char_34 |  to_char  
------------+-----------
            | f\ool 100
(1 row)

--Testcase 549:
SELECT '' AS to_char_35, to_char(a, 'f"ool\"999') FROM ceil_floor_round;
 to_char_35 | to_char  
------------+----------
            | fool"999
(1 row)

--Testcase 550:
SELECT '' AS to_char_36, to_char(a, 'f"ool\\"999') FROM ceil_floor_round;
 to_char_36 |  to_char  
------------+-----------
            | fool\ 100
(1 row)

--
-- Input syntax
--
CREATE FOREIGN TABLE num_input_test (n1 numeric) SERVER sqlite_svr;
-- good inputs
--Testcase 551:
INSERT INTO num_input_test(n1) VALUES (' 123');
--Testcase 552:
INSERT INTO num_input_test(n1) VALUES ('   3245874    ');
--Testcase 553:
INSERT INTO num_input_test(n1) VALUES ('  -93853');
--Testcase 554:
INSERT INTO num_input_test(n1) VALUES ('555.50');
--Testcase 555:
INSERT INTO num_input_test(n1) VALUES ('-555.50');
--Testcase 556:
INSERT INTO num_input_test(n1) VALUES ('NaN ');
--Testcase 557:
INSERT INTO num_input_test(n1) VALUES ('        nan');
-- bad inputs
--Testcase 558:
INSERT INTO num_input_test(n1) VALUES ('     ');
ERROR:  invalid input syntax for type numeric: "     "
LINE 1: INSERT INTO num_input_test(n1) VALUES ('     ');
                                               ^
--Testcase 559:
INSERT INTO num_input_test(n1) VALUES ('   1234   %');
ERROR:  invalid input syntax for type numeric: "   1234   %"
LINE 1: INSERT INTO num_input_test(n1) VALUES ('   1234   %');
                                               ^
--Testcase 560:
INSERT INTO num_input_test(n1) VALUES ('xyz');
ERROR:  invalid input syntax for type numeric: "xyz"
LINE 1: INSERT INTO num_input_test(n1) VALUES ('xyz');
                                               ^
--Testcase 561:
INSERT INTO num_input_test(n1) VALUES ('- 1234');
ERROR:  invalid input syntax for type numeric: "- 1234"
LINE 1: INSERT INTO num_input_test(n1) VALUES ('- 1234');
                                               ^
--Testcase 562:
INSERT INTO num_input_test(n1) VALUES ('5 . 0');
ERROR:  invalid input syntax for type numeric: "5 . 0"
LINE 1: INSERT INTO num_input_test(n1) VALUES ('5 . 0');
                                               ^
--Testcase 563:
INSERT INTO num_input_test(n1) VALUES ('5. 0   ');
ERROR:  invalid input syntax for type numeric: "5. 0   "
LINE 1: INSERT INTO num_input_test(n1) VALUES ('5. 0   ');
                                               ^
--Testcase 564:
INSERT INTO num_input_test(n1) VALUES ('');
ERROR:  invalid input syntax for type numeric: ""
LINE 1: INSERT INTO num_input_test(n1) VALUES ('');
                                               ^
--Testcase 565:
INSERT INTO num_input_test(n1) VALUES (' N aN ');
ERROR:  invalid input syntax for type numeric: " N aN "
LINE 1: INSERT INTO num_input_test(n1) VALUES (' N aN ');
                                               ^
--Testcase 566:
SELECT * FROM num_input_test;
   n1    
---------
     123
 3245874
  -93853
   555.5
  -555.5
        
        
(7 rows)

DO $d$
declare
  l_rec record;
begin
  for l_rec in (select foreign_table_schema, foreign_table_name 
                from information_schema.foreign_tables) loop
     execute format('drop foreign table %I.%I cascade;', l_rec.foreign_table_schema, l_rec.foreign_table_name);
  end loop;
end;
$d$;
DROP SERVER sqlite_svr;
DROP EXTENSION sqlite_fdw CASCADE;
